"ocid","release_id","id","title","description","status","date","amount","currency","correctedValue_amount","correctedValue_currency","enteredValue_amount","enteredValue_currency","contractPeriod_startDate","contractPeriod_endDate","contractPeriod_maxExtentDate","contractPeriod_durationInDays"
"ocds-5wno2w-RE-PU-ESPAMMFL-2025-02-25643","RE-PU-ESPAMMFL-2025-02-25643-2025-08-21T18:42:05.820Z-compiled","8303926-RE-PU-ESPAMMFL-2025-02","","De conformidad con Resolución de Adjudicación","","2025-08-12T17:01:24-05:00","16744.00","USD","","","","","","","",""
"ocds-5wno2w-RE-PU-FCQUCE-2025-001-81464","RE-PU-FCQUCE-2025-001-81464-2025-09-08T19:52:29.826Z-compiled","8285728-RE-PU-FCQUCE-2025-001","","Artículo 2.- ADJUDICAR el Proceso de Régimen Especial – Proveedor Único RE-PU-FCQUCE-2025-001, para la ?ADQUISICIÓN DE REACTIVOS PARA LOS EQUIPOS ROCHE COBAS C311 Y COBAS E411 DEL LABORATORIO DE ANALISIS CLÍNICOS Y BACTERIOLÓGICOS DE LA FACULTAD DE CIENCIAS QUÍMICAS - UCE?, al oferente ROCHE ECUADOR S.A., con numero de RUC 1790475689001, por cuanto su oferta cumple con todos los componentes de los productos esperados, requerimientos técnicos, financieros y legales exigidos en los pliegos, por el monto USD 18.753,94 DIECIOCHO MIL SETECIENTOS CINCUENTA Y TRES DÓLARES DE LOS ESTADOS UNIDOS DE AMÉRICA CON 94/100,  sin incluir IVA, con un plazo de ejecución de 10 días calendario contados a partir del día siguiente de la fecha de suscripción del último interviniente que firme electrónicamente el contrato.","","2025-08-01T14:50:41-05:00","18753.94","USD","","","","","","","",""
"ocds-5wno2w-RE-PU-ESPOLTECH-2025-003-375899","RE-PU-ESPOLTECH-2025-003-375899-2025-09-12T19:11:54.076Z-compiled","8294981-RE-PU-ESPOLTECH-2025-003","","CUMPLE CON LA INTEGRIDAD DE LA OFERTA","","2025-08-20T09:07:03-05:00","14835.00","USD","","","","","","","",""
"ocds-5wno2w-RE-PU-EPP-2025-011-253178","RE-PU-EPP-2025-011-253178-2025-09-29T18:58:56.341Z-compiled","8305322-RE-PU-EPP-2025-011","","Cumple con los requerimientos establecido en los TDR y pliego.","","2025-09-03T12:13:55-05:00","40729.80","USD","","","","","","","",""
"ocds-5wno2w-RE-PU-EPMAPS-2025-003-258814","RE-PU-EPMAPS-2025-003-258814-2025-10-16T19:58:57.440Z-compiled","8356042-RE-PU-EPMAPS-2025-003","","Por cumplir con las especificaciones técnicas, condiciones generales, particulares yrequisitos mínimos, requeridos por la EPMAPS.","","2025-09-12T10:26:46-05:00","9828.00","USD","","","","","","","",""
"ocds-5wno2w-RE-PU-IKIAM-2025-006-599302","RE-PU-IKIAM-2025-006-599302-2025-08-12T22:34:23.436Z-compiled","8257611-RE-PU-IKIAM-2025-006","","POR CUMPLIR CON LOS PARÁMETROS SOLICITADOS POR LA ENTIDAD","","2025-07-23T11:56:52-05:00","10001.63","USD","","","","","","","",""
"ocds-5wno2w-RE-PU-JPCAROLINA2009-2025-001-114721","RE-PU-JPCAROLINA2009-2025-001-114721-2025-08-12T22:50:10.475Z","8307458-RE-PU-JPCAROLINA2009-2025-001","","PROVEEDOR ADJUDICADO","","2025-08-12T14:33:08-05:00","11343.75","USD","","","","","","","",""
"ocds-5wno2w-RE-PU-HGSQ-2025-009-868544","RE-PU-HGSQ-2025-009-868544-2025-08-26T19:02:00.349Z-compiled","8279742-RE-PU-HGSQ-2025-009","","POR CUMPLIR CON TODO LO REQUERIDO EN LAS ESPECIFICACIONES TÉCNICAS Y PLIEGO DE CONTRATACIÓN","","2025-08-04T09:08:49-05:00","81147.00","USD","","","","","","","",""
"ocds-5wno2w-RE-PU-HGM-2025-003-74622","RE-PU-HGM-2025-003-74622-2025-09-10T20:12:40.299Z-compiled","8283453-RE-PU-HGM-2025-003","","CUMPLE CON TODO LO SOLICITADO EN LOS PLIEGOS","","2025-09-09T15:17:00-05:00","109000.00","USD","","","","","","","",""
"ocds-5wno2w-RE-PU-IGM-2025-006-36136","RE-PU-IGM-2025-006-36136-2025-09-19T19:48:23.088Z-compiled","8291578-RE-PU-IGM-2025-006","","Por cumplir con la integridad de la oferta, requisitos mínimos, técnicos y económicos solicitados en el pliego del proceso","","2025-08-25T15:29:40-05:00","33897.19","USD","","","","","","","",""
"ocds-5wno2w-RE-PU-HGNGC-2025-006-818925","RE-PU-HGNGC-2025-006-818925-2025-09-12T19:11:51.782Z-compiled","8283584-RE-PU-HGNGC-2025-006","","por cumplir con los requisitos mínimos solicitados en el pliego además de encontrarse debidamente habilitado en elSistema Oficial de Contratación Pública.","","2025-08-12T14:27:10-05:00","53613.36","USD","","","","","","","",""
"ocds-5wno2w-RE-PU-HGSF-2025-006-390394","RE-PU-HGSF-2025-006-390394-2025-09-03T19:15:01.209Z-compiled","8240524-RE-PU-HGSF-2025-006","","Por cumplir con los requisitos mínimos solicitados en el pliego y términos de referencia.","","2025-07-31T17:17:27-05:00","5580.00","USD","","","","","","","",""
"ocds-5wno2w-RE-PU-HGSF-2025-006-390394","RE-PU-HGSF-2025-006-390394-2025-09-03T19:15:01.209Z-compiled","8240727-RE-PU-HGSF-2025-006","","Por cumplir con los requisitos mínimos solicitados en el pliego y términos de referencia.","","2025-07-31T17:17:27-05:00","9006.00","USD","","","","","","","",""
"ocds-5wno2w-RE-PU-HGISD-2025-002-519694","RE-PU-HGISD-2025-002-519694-2025-09-08T19:58:53.996Z-compiled","8355718-RE-PU-HGISD-2025-002","","Por cumplir con los requisitos mínimos solicitados en el pliego, además de encontrarse debidamente habilitado en el SistemaOficial de Contratación Pública.","","2025-08-29T12:37:43-05:00","524791.41","USD","","","","","","","",""
"ocds-5wno2w-RE-PU-INOCAR-2025-003-1006003","RE-PU-INOCAR-2025-003-1006003-2025-09-13T19:07:01.030Z-compiled","8305998-RE-PU-INOCAR-2025-003","","ADJUDICAR, el proceso de Regimen Especial Nro. RE-PU-INOCAR-2025-003, para el ?SERVICIO DE MANTENIMIENTO PREVENTIVO Y CORRECTIVO PARA ESTACION MAREOGRÁFICA CONTINENTAL? a favor del oferente SISTEMAS TECNOLOGICOS ALCATECNI CIA. LTDA, con RUC: 1792357365001,representada legalmente por la señora CASTRO DAVILA MIRIAN SUSANA  por el valor $ 5.721,00 CINCO MIL SETECIENTOS VEINTIUNO CON 00/100 DÓLARES DE LOS ESTADOS UNIDOS DE NORTEAMERICA más IVA","","2025-08-27T09:13:27-05:00","5721.00","USD","","","","","","","",""
"ocds-5wno2w-RE-PU-MDMQ-2025-1302-41357","RE-PU-MDMQ-2025-1302-41357-2025-09-17T19:12:45.251Z-compiled","8284730-RE-PU-MDMQ-2025-1302","","ADJUDICAR el procedimiento de Régimen Especial – Proveedor Único,signado con el código No. RE-PU-MDMQ-2025-1302 a la compañía AMBACAR CIA.LTDA","","2025-08-06T22:31:53-05:00","58776.93","USD","","","","","","","",""
"ocds-5wno2w-RE-PU-MIMG-2025-004-44856","RE-PU-MIMG-2025-004-44856-2025-09-20T19:22:46.518Z-compiled","8314951-RE-PU-MIMG-2025-004","","por ser idonea desde el punto de vista juridico y haber cumplido con los requisitos establecidos en los pliegos, de conformidad con la Ley Organica del Sistema Nacional de Contratacion Publica, su Reglamento de Aplicacion y demas resoluciones vigentes del SERCOP","","2025-08-15T17:09:20-05:00","973867.01","USD","","","","","","","",""
"ocds-5wno2w-RE-PU-UTN-2025-11-83514","RE-PU-UTN-2025-11-83514-2025-09-03T19:15:21.134Z-compiled","8291647-RE-PU-UTN-2025-11","","La oferta presentada por el oferente invitado cumple con las condiciones técnicas, económicas y legales establecidas en el pliego del proceso, por lo que se RECOMIENDA su adjudicación a la Persona Jurídica E-LIBRO COMERCIA LIZADORA ELIBRO E LIBROEC S.A con RUC 1792725224001","","2025-08-08T14:46:53-05:00","12946.50","USD","","","","","","","",""
"ocds-5wno2w-RE-PU-HG-AM-2025-001-2764","RE-PU-HG-AM-2025-001-2764-2025-08-12T22:49:29.330Z-compiled","8286333-RE-PU-HG-AM-2025-001","","Por cumplir con los requisitos mínimos solicitados en el pliego y las especificaciones técnicas","","2025-08-08T10:13:47-05:00","58785.00","USD","","","","","","","",""
"ocds-5wno2w-RE-PU-HG-AM-2025-001-2764","RE-PU-HG-AM-2025-001-2764-2025-08-12T22:49:29.330Z-compiled","8286335-RE-PU-HG-AM-2025-001","","Por cumplir con los requisitos mínimos solicitados en el pliego y las especificaciones técnicas","","2025-08-08T10:13:47-05:00","19140.00","USD","","","","","","","",""
"ocds-5wno2w-RE-PU-HGIIIDE-TARQUI2025-002-88080","RE-PU-HGIIIDE-TARQUI2025-002-88080-2025-08-12T22:34:44.708Z-compiled","8269001-RE-PU-HGIIIDE-TARQUI2025-002","","POR CUMPLIR CON LO ESTABLECIDO EN LOS PLIEGOS Y LA  NORMATIVA LEGAL VIGENTE DEL SERCOP","","2025-07-21T14:12:27-05:00","1360.00","USD","","","","","","","",""
"ocds-5wno2w-RE-PU-GADMUR-2025-006-2485","RE-PU-GADMUR-2025-006-2485-2025-09-29T18:58:45.809Z-compiled","8253422-RE-PU-GADMUR-2025-006","","Artículo 1.-  ADJUDICAR al oferente LUIS EDUARDO ALBAN LOPEZ LEAL IMPORTACIONES COMPAÑIA LIMITADA con RUC Nro. 1792101263001, el contrato del proceso de régimenespecial por proveedor único signado con el código Nro. RE-PU-GADMUR-2025-006 para laejecución del proyecto ?PLAN DE MOVILIDAD CANTONAL SOSTENIBLE -CONTRATACIÓN DEL SERVICIO DE MANTENIMIENTO PREVENTIVO Y CORRECTIVODE LOS EQUIPOS Y MAQUINARIA DEL CRTV 2025-2026? por el valor de TREINTA Y UNMIL QUINIENTOS CON 00/100 DÓLARES DE LOS ESTADOS UNIDOS DE AMÉRICA$31.500,00 sin incluir el valor del IVA., con un plazo de ejecución de contrato deDOSCIENTOS OCHENTA 280 días calendario, contados a partir del día siguiente de lasuscripción del respectivo contrato, acogiendo la recomendación emitida por el responsablede la ejecución de la fase precontractual en el informe de evaluación de las ofertas y deresultados y, de conformidad con lo que dispone el artículo 6 numeral 18 de la LOSNCP.","","2025-07-29T11:23:52-05:00","31500.00","USD","","","","","","","",""
"ocds-5wno2w-RE-PU-HE-1-2025-095-43246","RE-PU-HE-1-2025-095-43246-2025-09-23T18:58:44.419Z-compiled","8304076-RE-PU-HE-1-2025-095","","Por cumplir con todos los requisitos solicitados por la Entidad","","2025-08-17T08:55:27-05:00","15985.72","USD","","","","","","","",""
"ocds-5wno2w-RE-PU-HEP-2025-00007-889479","RE-PU-HEP-2025-00007-889479-2025-08-21T18:42:02.469Z-compiled","8280866-RE-PU-HEP-2025-00007","","Se resuelve adjudicar a favor de TRADEMEDIC CIA. LTDA., con RUC 1792078369001, el contrato del Procedimiento de Régimen Especial con Proveedor Único No. RE-PU-HEP-2025-00007, para la ?ADQUISICIÓN DE ACCESORIOS, PARTES Y PIEZAS QUE INCLUYA EL MANTENIMIENTO PREVENTIVO Y CORRECTIVO DEL TOMÓGRAFO NEUVIZ 64IN PORTÁTIL DEL HOSPITAL DE ESPECIALIDADES PORTOVIEJO?, por un valor de USD$ 118.525,82 Ciento dieciocho mil quinientos veinticinco con 82/100 dólares de los Estados Unidos de América con un plazo de ejecución de 270 días calendario.","","2025-08-08T12:31:49-05:00","24900.00","USD","","","","","","","",""
"ocds-5wno2w-RE-PU-HEP-2025-00007-889479","RE-PU-HEP-2025-00007-889479-2025-08-21T18:42:02.469Z-compiled","8280911-RE-PU-HEP-2025-00007","","Se resuelve adjudicar a favor de TRADEMEDIC CIA. LTDA., con RUC 1792078369001, el contrato del Procedimiento de Régimen Especial con Proveedor Único No. RE-PU-HEP-2025-00007, para la ?ADQUISICIÓN DE ACCESORIOS, PARTES Y PIEZAS QUE INCLUYA EL MANTENIMIENTO PREVENTIVO Y CORRECTIVO DEL TOMÓGRAFO NEUVIZ 64IN PORTÁTIL DEL HOSPITAL DE ESPECIALIDADES PORTOVIEJO?, por un valor de USD$ 118.525,82 Ciento dieciocho mil quinientos veinticinco con 82/100 dólares de los Estados Unidos de América con un plazo de ejecución de 270 días calendario.","","2025-08-08T12:31:49-05:00","93625.82","USD","","","","","","","",""
"ocds-5wno2w-RE-PU-HEEE-2025-013-52558","RE-PU-HEEE-2025-013-52558-2025-08-28T18:58:33.206Z-compiled","8292464-RE-PU-HEEE-2025-013","","ADJUDICAR el proceso de Régimen Especial –Proveedor Único, signado con el código Nro.RE-PU-HEEE-2025-013, cuyo objeto es la ?ADQUISICIÓN DEL MEDICAMENTO ABEMACICLIBSÓLIDO ORAL 150MG PARA PACIENTES AUTORIZADOS AR.TO.MA.TE. Y AS.BR.LU.GE. COD.CONFIDENCIALIDAD PARA EL HOSPITAL DE ESPECIALIDADES EUGENIO ESPEJO?, a laempresa MEDICAMENTA ECUATORIANA S.A., con RUC Nro. 1790775941001, por un valor de USD29.181,60 VEINTE Y NUEVE MIL CIENTO OCHENTA Y UNO CON 60/100 DÓLARES DE LOSESTADOS UNIDOS DE AMERICA, sin IVA.","","2025-08-07T08:52:48-05:00","29181.60","USD","","","","","","","",""
"ocds-5wno2w-RE-PU-HEEE-2025-011-52558","RE-PU-HEEE-2025-011-52558-2025-08-30T19:07:46.522Z-compiled","8293233-RE-PU-HEEE-2025-011","","ADJUDICADO SEGUN RESOLUCUION MSP-CZ9-HEEE-DAF-2025-0098-R","","2025-08-08T13:46:29-05:00","71570.00","USD","","","","","","","",""
"ocds-5wno2w-RE-PU-HCAM-2025-023-54651","RE-PU-HCAM-2025-023-54651-2025-09-04T18:36:22.418Z-compiled","8276597-RE-PU-HCAM-2025-023","","POR CUMPLIR CON LO SOLICITADO POR LA INSTITUCIÓN","","2025-08-05T14:18:31-05:00","180161.85","USD","","","","","","","",""
"ocds-5wno2w-RE-PU-HCAM-2025-014-54651","RE-PU-HCAM-2025-014-54651-2025-09-12T19:11:59.863Z-compiled","8309245-RE-PU-HCAM-2025-014","","CUMPLE CON LO SOLICITADO POR ESTA CASA DE SALUD","","2025-08-19T17:46:05-05:00","770058.00","USD","","","","","","","",""
"ocds-5wno2w-RE-PU-GADMUR-2025-011-2485","RE-PU-GADMUR-2025-011-2485-2025-09-24T18:55:35.440Z-compiled","8309098-RE-PU-GADMUR-2025-011","","Conforme Resolución Administrativa No. GADMUR-DA-2025-0532-R","","2025-08-20T17:40:58-05:00","19360.00","USD","","","","","","","",""
"ocds-5wno2w-RE-PU-UPEC-2025-010-24327","RE-PU-UPEC-2025-010-24327-2025-08-12T22:34:55.022Z-compiled","8281658-RE-PU-UPEC-2025-010","","CUMPLE CON LO SOLICITADO EN LOS PLIEGOS Y POR CONVENIR A LOS INTERESES DE LA INSTITUCIÓN","","2025-08-01T15:19:49-05:00","7525.00","USD","","","","","2025-08-08T00:00:00-05:00","2026-08-08T00:00:00-05:00","","365"
"ocds-5wno2w-RE-PU-UTN-2025-10-83514","RE-PU-UTN-2025-10-83514-2025-10-02T19:03:38.524Z-compiled","8291937-RE-PU-UTN-2025-10","","Acoger la RECOMENDACIÓN realizada por la Técnica designada para la Etapa Precontractual del proceso y ADJUDICAR el proceso de RÉGIMEN ESPECIAL-PROVEEDOR ÚNICO signado como RE-PU-UTN-2025-10, para la ?CONTRATACIÓN DE LA SUSCRIPCIÓN A LA BASE DE DATOS TAYLOR & FRANCIS PARA LA BIBLIOTECA DE LA UNIVERSIDAD TÉCNICA DEL NORTE?, a la Persona Jurídica DIFUCIEN ECUADOR CIA. LTDA. con RUC 1792463262001, representada legalmente por la Sra. Nelly Victoria Montesdeoca León, por un valor de USD 15.631,00 QUINCE MIL SEISCIENTOS TREINTA Y UN DÓLARES DE LOS ESTADOS UNIDOS DE AMÉRICA con 00/100 sin incluir el IVA","","2025-08-07T15:49:54-05:00","15631.00","USD","","","","","","","",""
"ocds-5wno2w-RE-PU-UITEY-2025-002-541976","RE-PU-UITEY-2025-002-541976-2025-08-21T18:42:04.503Z-compiled","8285583-RE-PU-UITEY-2025-002","","Conforme resolución de adjudicación No. UITEY-2025-66-CP-R","","2025-08-04T15:19:49-05:00","3468.75","USD","","","","","","","",""
"ocds-5wno2w-RE-PU-UINPIAW23-2025-004-959480","RE-PU-UINPIAW23-2025-004-959480-2025-08-28T18:58:34.182Z-compiled","8311453-RE-PU-UINPIAW23-2025-004","","Por cumplir con lo determinado en los términos de referencia y los pliegos del presente proceso.","","2025-08-20T12:22:13-05:00","8082.25","USD","","","","","","","",""
"ocds-5wno2w-RE-PU-UNACH-2025-010-124774","RE-PU-UNACH-2025-010-124774-2025-08-30T19:07:45.598Z-compiled","8283979-RE-PU-UNACH-2025-010","","CUMPLE CON LO REQUERIDO POR LA ENTIDAD","","2025-08-05T12:24:14-05:00","16800.00","USD","","","","","","","",""
"ocds-5wno2w-RE-PU-UNACH-2025-009-124774","RE-PU-UNACH-2025-009-124774-2025-09-04T18:36:23.445Z-compiled","8285205-RE-PU-UNACH-2025-009","","CUMPLE CON LO REQUERIDO","","2025-08-04T16:44:31-05:00","38880.00","USD","","","","","","","",""
"ocds-5wno2w-RE-PU-UINPIAW23-2025-003-959480","RE-PU-UINPIAW23-2025-003-959480-2025-09-15T19:20:19.427Z-compiled","8301893-RE-PU-UINPIAW23-2025-003","","Por cumplir con lo determinado en los términos de referencia y los pliegos del presente proceso.","","2025-09-10T13:56:21-05:00","17000.00","USD","","","","","","","",""
"ocds-5wno2w-RE-PU-UC-2025-003-30951","RE-PU-UC-2025-003-30951-2025-09-20T19:22:49.086Z-compiled","8369736-RE-PU-UC-2025-003","","ARTÍCULO 1.- ADJUDICAR el contrato derivado del procedimiento de contratación de Régimen Especial –Proveedor único, con código RE-PU-UC-2025-003, para la ?ADQUISICIÓN DE ESCANER INTRA ORAL PARAEL ÁREA DE CLÍNICA DE POSGRADOS DE LA FACULTAD DE ODONTOLOGÍA DE LA UNIVERSIDAD DECUENCA? a favor del oferente PRODENTEC CIA. LTDA. con RUC No. 0190372758001.","","2025-09-09T16:47:36-05:00","25072.40","USD","","","","","","","",""
"ocds-5wno2w-RE-PU-PMIS-2025-001-212187","RE-PU-PMIS-2025-001-212187-2025-08-25T18:49:09.394Z-compiled","8295094-RE-PU-PMIS-2025-001","","POR CUMPLIR CON TODOS LOS PARAMETROS REQUERIDOS POR LA ENTIDAD CONTRATANTE","","2025-08-13T09:08:19-05:00","3688.00","USD","","","","","","","",""
"ocds-5wno2w-RE-PU-ISSFA-2025-04-2803","RE-PU-ISSFA-2025-04-2803-2025-09-10T20:09:38.851Z-compiled","8306656-RE-PU-ISSFA-2025-04","","EL PROVEEDOR CUMPLE CON LOS REQUISITOS ESTABLECIDOS EN LOS PLIEGOS","","2025-08-29T08:57:17-05:00","184695.60","USD","","","","","","","",""
"ocds-5wno2w-RE-PU-EPAAGE-MEJIA-2025-06-384004","RE-PU-EPAAGE-MEJIA-2025-06-384004-2025-08-14T17:45:42.859Z","8309879-RE-PU-EPAAGE-MEJIA-2025-06","","ADJUDICAR, el proceso No. RE-PU-EPAAGE-MEJIA-2025-06, para el?MANTENIMIENTO DE LA VOLQUETA PROPIEDAD DE LA EPAAGE-MEJIA, EP?, a nombre deloferente VEHICENTRO VEHICULOS Y CAMIONES CENTRO SIERRA S.A, con RUC1891724612001, por el valor de $ 7.841,15 Siete Mil Ochocientos Cuarenta y Un con 15/100 dólaresde los Estados Unidos de América más IVA, con un plazo de ejecución de 174 días a partir de lasuscripción del contrato, o hasta que se agote el valor asignado mediante órdenes de servicio emitidaspor el administrador del contrato correspondiente.","","2025-08-13T17:21:41-05:00","7841.15","USD","","","","","","","",""
"ocds-5wno2w-RE-PU-HIESSRI-2025-003-2561","RE-PU-HIESSRI-2025-003-2561-2025-09-06T18:39:34.397Z-compiled","8303111-RE-PU-HIESSRI-2025-003","","por cuanto cumple con todos los requerimientos técnicos y legales","","2025-08-13T17:11:59-05:00","13288.59","USD","","","","","","","",""
"ocds-5wno2w-RE-PU-HAGP-2025-002-17993","RE-PU-HAGP-2025-002-17993-2025-09-29T18:59:26.369Z-compiled","8356438-RE-PU-HAGP-2025-002","","POR CUMPLIR CON LOS PARAMETROS ESTABLECIDOS EN PLIEGO Y ANEXOS DE ESPECIFICACIONES TECNICAS","","2025-09-06T11:42:31-05:00","170000.00","USD","","","","","","","",""
"ocds-5wno2w-RE-PU-HCAM-2025-024-54651","RE-PU-HCAM-2025-024-54651-2025-08-30T19:07:46.356Z-compiled","8290986-RE-PU-HCAM-2025-024","","Por cuanto su oferta cumple con las condiciones y términos establecidos en los pliegos y es conveniente a los intereses técnicos, financieros y legales de la Institución, de conformidad con el numeral 17 del artículo 6 de la LOSNCP","","2025-08-14T13:44:38-05:00","116726.40","USD","","","","","","","",""
"ocds-5wno2w-RE-PU-HAGP-2025-003-17993","RE-PU-HAGP-2025-003-17993-2025-09-23T18:59:04.776Z-compiled","8356523-RE-PU-HAGP-2025-003","","POR CUMPLIR CON LAS ESPECIFICACIONES TÉCNICAS Y DEMÁS REQUISITOS MÍNIMOS SOLICITADOS EN LOS PLIEGOS","","2025-09-10T12:20:21-05:00","171000.00","USD","","","","","","","",""
"ocds-5wno2w-RE-PU-HAGP-2025-003-17993","RE-PU-HAGP-2025-003-17993-2025-09-23T18:59:04.776Z-compiled","8356549-RE-PU-HAGP-2025-003","","POR CUMPLIR CON LAS ESPECIFICACIONES TÉCNICAS Y DEMÁS REQUISITOS MÍNIMOS SOLICITADOS EN LOS PLIEGOS","","2025-09-10T12:20:21-05:00","29227.89","USD","","","","","","","",""
"ocds-5wno2w-RE-PU-HAGP-2025-004-17993","RE-PU-HAGP-2025-004-17993-2025-09-25T18:57:33.447Z-compiled","8356359-RE-PU-HAGP-2025-004","","POR CUMPLIR CON LAS ESPECIFICACIONES TÉCNICAS Y DEMÁS REQUISITOS MÍNIMOS SOLICITADOS EN LOS PLIEGOS","","2025-09-10T12:53:20-05:00","88960.00","USD","","","","","","","",""
"ocds-5wno2w-RE-PU-SNMLCF-2025-004-772102","RE-PU-SNMLCF-2025-004-772102-2025-10-06T19:43:13.858Z-compiled","8309111-RE-PU-SNMLCF-2025-004","","CUMPLE CON LO ESTABLECIDO EN LOS PLIEGOS Y ESPECIFICACIONES TECNICAS","","2025-08-15T11:09:02-05:00","47967.00","USD","","","","","","","",""
"ocds-5wno2w-RE-PU-UNACH-2025-007-124774","RE-PU-UNACH-2025-007-124774-2025-08-15T17:46:11.370Z-compiled","8279914-RE-PU-UNACH-2025-007","","CUMPLE CON LO REQUERIDO POR LA ENTIDAD","","2025-08-05T17:07:12-05:00","5270.00","USD","","","","","","","",""
"ocds-5wno2w-RE-PU-UNAE-2025-009-607247","RE-PU-UNAE-2025-009-607247-2025-08-15T17:46:10.794Z-compiled","8277753-RE-PU-UNAE-2025-009","","RESOLUCIÓN DE ADJUDICACIÓN N RE-ADJ-UNAE-017-2025","","2025-08-04T16:33:27-05:00","16900.00","USD","","","","","","","",""
"ocds-5wno2w-RE-PU-UIDH-2025-00002-215345","RE-PU-UIDH-2025-00002-215345-2025-09-11T19:53:02.740Z-compiled","8358655-RE-PU-UIDH-2025-00002","","Al amparo de los artículos 32 de la Ley Orgánica del Sistema Nacional de Contratación Pública, artículo 89 del Reglamento General a la Ley Orgánica del Sistema Nacional de Contratación Pública, y por convenir a los intereses institucionales, de conformidad con lo que determina la Ley Orgánica del Sistema Nacional de Contratación Pública.","","2025-09-03T09:07:57-05:00","11519.40","USD","","","","","","","",""
"ocds-5wno2w-RE-PU-UNL-2025-008-4092","RE-PU-UNL-2025-008-4092-2025-09-18T19:28:50.438Z-compiled","8306559-RE-PU-UNL-2025-008","","Por considerar la oferta más idónea según el informe del Delegado y la Resolución Nro. 257/2025-R-DCP-UNL","","2025-08-28T15:57:14-05:00","27904.00","USD","","","","","","","",""
"ocds-5wno2w-RE-PU-SZE-2025-003-110642","RE-PU-SZE-2025-003-110642-2025-09-24T18:55:41.970Z-compiled","8360595-RE-PU-SZE-2025-003","","Por cumplir con todos los requisitos y parámetros establecidos, y de acuerdo a la calificación técnica realizada por la  comisión.","","2025-09-09T16:26:56-05:00","27299.27","USD","","","","","","","",""
"ocds-5wno2w-RE-PU-UTN-2025-13-83514","RE-PU-UTN-2025-13-83514-2025-09-25T18:57:30.320Z-compiled","8317075-RE-PU-UTN-2025-13","","Acoger la RECOMENDACIÓN realizada por el Técnico designado para la Etapa Precontractual del proceso y ADJUDICAR el proceso de RÉGIMEN ESPECIAL-PROVEEDOR ÚNICO signado como RE-PU-UTN-2025-13, para la ?CONTRATACIÓN DEL SERVICIO PARA LA PROVISIÓN DE COMBUSTIBLE DIÉSEL 2 INDUSTRIAL PARA EL FUNCIONAMIENTO DE LOS CALDEROS DEL CUARTO DE MÁQUINAS DEL COMPLEJO ACUÁTICO, MAQUINARIA Y TRACTORES DE LA HACIENDA SANTA MÓNICA Y GRANJA EXPERIMENTAL LA PRADERA DE LA UNIVERSIDAD TÉCNICA DEL NORTE?, a la Persona Jurídica COMERCIOS Y AFINES DEL NORTE COYANOR S.A., con RUC: 1091720821001, representada legalmente por la Sra. Laura Judith Aguirre Flores, por un valor de USD 17.000,00 DIECISIETE MIL DÓLARES DE LOS ESTADOS UNIDOS DE AMÉRICA con 00/100 sin incluir IVA.","","2025-09-03T16:35:09-05:00","17000.00","USD","","","","","","","",""
"ocds-5wno2w-RE-PU-CBR-2025-001-1073475","RE-PU-CBR-2025-001-1073475-2025-08-25T18:52:19.784Z-compiled","8327112-RE-PU-CBR-2025-001","","Artículo 1. ADJUDICAR el Proceso de Régimen Especial Nro. RE-PU-CBR-2025-001, cuyo objeto es la ?CONTRATACIÓN DEL SERVICIO DE SOPORTE DEL SISTEMA CGWEB 2025 2026?, al oferente: Información Tecnológica del Ecuador Luxeinform S.A. con RUC: 1791305035001, por un valor de $ 6.900,00 SEIS MIL NOVECIENTOS CON 00/100 DÓLARES DE LOS ESTADOS UNIDOS DE AMÉRICA más IVA, con un plazo conforme lo describe en el numeral 11 de los Términos de Referencia Nro. CBR-GTIC-TDR-2025-007.","","2025-08-25T12:43:35-05:00","6900.00","USD","","","","","","","",""
"ocds-5wno2w-RE-PU-CZ1S-2025-001-423779","RE-PU-CZ1S-2025-001-423779-2025-10-16T20:06:19.964Z-compiled","8358225-RE-PU-CZ1S-2025-001","","Acogiendo la recomendación constante en el Informe de Recomendación de Adjudicación.","","2025-09-12T14:48:34-05:00","92482.50","USD","","","","","","","",""
"ocds-5wno2w-RE-PU-GIR-Z9-2025-001-37185","RE-PU-GIR-Z9-2025-001-37185-2025-08-28T18:58:33.620Z-compiled","8299881-RE-PU-GIR-Z9-2025-001","","Conforme al Art. 32 de la LOSNCP","","2025-08-15T18:19:04-05:00","17793.12","USD","","","","","","","",""
"ocds-5wno2w-RE-PU-GADMPS-2025-00005-21123","RE-PU-GADMPS-2025-00005-21123-2025-09-10T20:09:45.095Z-compiled","8359290-RE-PU-GADMPS-2025-00005","","Luego de la revisión, análisis, y calificación de ofertas, el delegado de la máxima autoridad mediante resolución administrativa Nro. GADMPS-A-2025-002-RE, de fecha 15 de agosto de 2025, pide a la máxima autoridad o su delegado, adjudicar al proveedor único IASA S.A. con RUC: 0990011109001, representado por el Sr. Juan Xavier Escudero Elizalde, Apoderado Especial, que es conveniente para los intereses institucionales por cumplir con la integridad de la oferta","","2025-09-01T15:28:40-05:00","48847.43","USD","","","","","","","",""
"ocds-5wno2w-RE-PU-GADMCO-2025-14-26427","RE-PU-GADMCO-2025-14-26427-2025-08-22T18:45:04.367Z-compiled","8331543-RE-PU-GADMCO-2025-14","","CUMPLE CON LOS REQUISITOS TECNICOS, ECONOMICOS Y LEGALES-REVISAR RESOLUCION No. 061-ADJ-GADMCO-2025","","2025-08-21T20:07:58-05:00","16174.24","USD","","","","","","","",""
"ocds-5wno2w-RE-PU-EPMT-SD-2025-002-479584","RE-PU-EPMT-SD-2025-002-479584-2025-09-10T20:13:25.102Z-compiled","8342599-RE-PU-EPMT-SD-2025-002","","CUMPLE CON LO SOLICITADO POR LA EPMTSD","","2025-09-09T15:44:43-05:00","22836.53","USD","","","","","","","",""
"ocds-5wno2w-RE-PU-IESS-2025-00007-39594","RE-PU-IESS-2025-00007-39594-2025-09-03T19:15:23.174Z-compiled","8337419-RE-PU-IESS-2025-00007","","Se adjudica el contrato por haber cumplido con los parámetros, técnicos, económicos y legales.","","2025-08-18T11:01:26-05:00","30944.80","USD","","","","","","","",""
"ocds-5wno2w-RE-PU-EENORTE-2025-082-3243","RE-PU-EENORTE-2025-082-3243-2025-10-06T19:43:16.026Z-compiled","8329937-RE-PU-EENORTE-2025-082","","CUMPLE CON REQUERIMIENTOS SOLICITADOS POR LA EMPRESA","","2025-08-26T16:15:38-05:00","19115.00","USD","","","","","","","",""
"ocds-5wno2w-RE-PU-BCE-2025-004-2457","RE-PU-BCE-2025-004-2457-2025-10-07T19:38:00.299Z-compiled","8325968-RE-PU-BCE-2025-004","","POR CUMPLIR CON LA INTEGRIDAD DE LA OFERTA, REQUISITOS MÍNIMOS SOLICITADAS EN LOS PLIEGOS, Y PORQUE SU PROPUESTA REPRESENTA EL MEJOR COSTO, DE ACUERDO A LO DEFINIDO EN EL NÚMERO 17 DEL ARTÍCULO 6 DE LA LEY ORGÁNICA DEL SISTEMA NACIONAL DE CONTRATACIÓN PÚBLICA","","2025-08-22T15:52:48-05:00","26200.00","USD","","","","","","","",""
