"ocid","release_id","id","title","description","status","date","amount","currency","correctedValue_amount","correctedValue_currency","enteredValue_amount","enteredValue_currency","contractPeriod_startDate","contractPeriod_endDate","contractPeriod_maxExtentDate","contractPeriod_durationInDays"
"ocds-5wno2w-RE-PU-MDMQ-2025-1510-41357","RE-PU-MDMQ-2025-1510-41357-2025-06-04T15:44:09.656Z-compiled","7953899-RE-PU-MDMQ-2025-1510","","La adjudicación se realiza en virtud que el oferente cumple con todo los requisitos exigidos en los pliegos y demás normativa, según consta en la Resolución de Dirección Ejecutiva GADDMQ-IMP-2025-0036-R","","2025-04-16T17:04:28-05:00","2374.20","USD","","","","","","","",""
"ocds-5wno2w-RE-PU-CELECEP-2025-06027-238940","RE-PU-CELECEP-2025-06027-238940-2025-06-04T15:44:10.471Z-compiled","7963119-RE-PU-CELECEP-2025-06027","","CUMPLE LO SOLICITADO","","2025-04-22T11:03:26-05:00","61235.00","USD","","","","","","","",""
"ocds-5wno2w-RE-PU-HVCM-2025-002-12070","RE-PU-HVCM-2025-002-12070-2025-06-11T15:47:36.453Z-compiled","7956389-RE-PU-HVCM-2025-002","","Se recomienda a la máxima autoridad, la adjudicación al oferente SIEMENSHEALTHCARECIA. LTDA., con RUC No. 1792390834001, debido a que la oferta presentada, después de ser analizado minuciosamente, SI CUMPLE con la integridad, requisitos y parámetros mínimos solicitados, y el costo de la oferta se encuentra dentro de los establecido por la Ley","","2025-04-08T11:59:09-05:00","24890.00","USD","","","","","","","",""
"ocds-5wno2w-RE-PU-HOSNAG-2025-001-2706","RE-PU-HOSNAG-2025-001-2706-2025-04-10T12:37:45.663Z-compiled","7960760-RE-PU-HOSNAG-2025-001","","POR CUMPLIR CON TODAS LOS REQUISITOS ESTABLECIDOS EN LA SECCION CUARTA DE LOS PLIEGOS DE CONTRATACION","","2025-04-08T09:46:10-05:00","38493.00","USD","","","","","","","",""
"ocds-5wno2w-RE-PU-HCAM-2025-001-54651","RE-PU-HCAM-2025-001-54651-2025-04-23T12:29:23.584Z-compiled","7922852-RE-PU-HCAM-2025-001","","la oferta cumplecon los parámetros establecidos en las especificaciones técnicas y pliego","","2025-03-31T17:11:53-05:00","245072.82","USD","","","","","","","",""
"ocds-5wno2w-RE-PU-HEEE-2025-003-52558","RE-PU-HEEE-2025-003-52558-2025-04-16T12:40:43.032Z-compiled","7915559-RE-PU-HEEE-2025-003","","SI CUMPLE CON LOS PARAMETROS REQUERIDOS EN LOS PLIEGOS","","2025-03-25T08:11:06-05:00","117000.00","USD","","","","","","","",""
"ocds-5wno2w-RE-PU-CCFFAA-2025-001-2539","RE-PU-CCFFAA-2025-001-2539-2025-04-30T12:29:36.657Z-compiled","7933813-RE-PU-CCFFAA-2025-001","","Por cumplir con todos los requerimientos establecidos en los pliegos y términos de referencia","","2025-04-01T15:13:40-05:00","6999.93","USD","","","","","","","",""
"ocds-5wno2w-RE-PU-EPMTTM-2025-01-393608","RE-PU-EPMTTM-2025-01-393608-2025-06-03T15:38:55.863Z-compiled","7957698-RE-PU-EPMTTM-2025-01","","El proveedor único cumple con las condiciones mínimas establecidas en los términos de referencia y pliego","","2025-04-22T10:05:34-05:00","15810.00","USD","","","","","","","",""
"ocds-5wno2w-RE-PU-HEJCA-2025-006-87497","RE-PU-HEJCA-2025-006-87497-2025-04-23T12:29:24.258Z-compiled","7924859-RE-PU-HEJCA-2025-006","","POR CUMPLIR CON LO REQUERIDO POR LA INSTITUCIÓN.","","2025-03-26T16:05:12-05:00","187207.20","USD","","","","","","","",""
"ocds-5wno2w-RE-PU-HDGDZ-2025-003-62010","RE-PU-HDGDZ-2025-003-62010-2025-08-12T22:25:38.396Z-compiled","7927512-RE-PU-HDGDZ-2025-003","","Oferta cumple con la integridad, requisitos y parámetros mínimos  solicitados dentro del proceso","","2025-03-26T09:53:55-05:00","1188.66","USD","","","","","","","",""
"ocds-5wno2w-RE-PU-SENAEDDG-2025-01-124235","RE-PU-SENAEDDG-2025-01-124235-2025-05-07T12:36:38.951Z-compiled","7971197-RE-PU-SENAEDDG-2025-01","","Proveedor cumple con todo lo establecido en los pliegos","","2025-04-28T16:01:32-05:00","14870.30","USD","","","","","","","",""
"ocds-5wno2w-RE-PU-DNPJ-2025-001-183304","RE-PU-DNPJ-2025-001-183304-2025-04-30T12:29:38.528Z-compiled","7943265-RE-PU-DNPJ-2025-001","","POR CUMPLIR CON LOS TÉRMINOS DE REFERENCIA Y PLIEGOS.","","2025-04-07T08:29:31-05:00","3690.00","USD","","","","","","","",""
"ocds-5wno2w-RE-PU-CDBC-2025-001-70988","RE-PU-CDBC-2025-001-70988-2025-05-01T12:36:04.466Z-compiled","7935227-RE-PU-CDBC-2025-001","","Una vez analizada la información publicada por el portal de compras públicas, y cumpliendo conlo que establece el Art. 88 del Reglamento General a la LOSNCP referente a ?Término para laadjudicación. - ? la resolución de adjudicación se emitirá en un término no menor a tres días3 días, contados a partir de la fecha de emisión de la actuación que pone fin a la etapa decalificación de ofertas ??, la designado para la calificación, recomienda se adjudique aloferente ASSA-AUTOMOTORES DE LA SIERRA S.A. con RUC 1890000130001, para laejecución del proceso ?SERVICIO PARA REALIZAR LOS MANTENIMIENTOS PREVENTIVOS YCORRECTIVOS POR VIGENCIA TECNOLÓGICA A LAS CAMIONETAS NUEVAS?.","","2025-03-27T15:52:28-05:00","9829.64","USD","","","","","","","",""
"ocds-5wno2w-RE-PU-ESNAQI-2025-001-2554","RE-PU-ESNAQI-2025-001-2554-2025-04-29T12:22:05.016Z-compiled","7967189-RE-PU-ESNAQI-2025-001","","ADJUDICAR AL PROVEEDOR SELECCIONADO MEDIANTE RESOLUCIÓN  ESNAQI-UCP-2025-014","","2025-04-09T17:16:17-05:00","16301.81","USD","","","","","","","",""
"ocds-5wno2w-RE-PU-GADC-2025-18875-2616","RE-PU-GADC-2025-18875-2616-2025-04-29T12:22:04.893Z-compiled","7965282-RE-PU-GADC-2025-18875","","Por cumplir con todos los requisitos solicitados en los pliegos y ser la oferta más conveniente a los intereses institucionales de la entidad contratante.","","2025-04-15T08:29:09-05:00","50235.48","USD","","","","","","","",""
"ocds-5wno2w-RE-PU-HSLO-2025-01-2580","RE-PU-HSLO-2025-01-2580-2025-05-09T12:33:30.018Z-compiled","7943043-RE-PU-HSLO-2025-01","","El oferente cumple con los requisitos mínimos solicitados  en los pliegos solicitados por la institución","","2025-03-27T14:44:54-05:00","13690.00","USD","","","","","","","",""
"ocds-5wno2w-RE-PU-CNE-2025-001-2546","RE-PU-CNE-2025-001-2546-2025-04-11T12:58:45.202Z-compiled","7935423-RE-PU-CNE-2025-001","","El CNE resuelve adjudicar mediante Resolución Nro. CNE-DNA-2025-0009-","","2025-03-28T17:09:13-05:00","24975.00","USD","","","","","","","",""
"ocds-5wno2w-RE-PU-GADPP-2025-4-2426","RE-PU-GADPP-2025-4-2426-2025-05-09T12:32:30.834Z-compiled","7950591-RE-PU-GADPP-2025-4","","Por cumplir con la integridad de la oferta y requisitos mínimos.","","2025-03-27T15:53:43-05:00","13500.00","USD","","","","","","","",""
"ocds-5wno2w-RE-PU-UEA-2025-002-124342","RE-PU-UEA-2025-002-124342-2025-06-06T15:45:43.630Z-compiled","7963110-RE-PU-UEA-2025-002","","CUMPLE CON LOS PARÁMETROS ESTABLECIDOS EN LOS PLIEGOS","","2025-04-29T17:15:23-05:00","10500.00","USD","","","","","","","",""
"ocds-5wno2w-RE-PU-GADMSR-2025-001-38391","RE-PU-GADMSR-2025-001-38391-2025-04-16T12:41:40.559Z-compiled","7964839-RE-PU-GADMSR-2025-001","","POR CUMPLIR CON LOS SOLICITADO","","2025-04-14T15:07:04-05:00","54540.00","USD","","","","","","","",""
"ocds-5wno2w-RE-PU-CEN-2025-001-715112","RE-PU-CEN-2025-001-715112-2025-05-01T12:36:07.866Z-compiled","7972273-RE-PU-CEN-2025-001","","CUMPLE CON LOS REQUISITOS SOLICITADOS EN LOS PLIEGOS","","2025-04-22T07:51:43-05:00","39085.00","USD","","","","","","","",""
"ocds-5wno2w-RE-PU-HGSQ-2025-005-868544","RE-PU-HGSQ-2025-005-868544-2025-05-31T15:38:44.507Z-compiled","7972363-RE-PU-HGSQ-2025-005","","Por cumplir con las especificaciones técnicas solicitadas por la Institución","","2025-05-01T09:44:40-05:00","145856.89","USD","","","","","","","",""
"ocds-5wno2w-RE-PU-HGSQ-2025-005-868544","RE-PU-HGSQ-2025-005-868544-2025-05-31T15:38:44.507Z-compiled","7972518-RE-PU-HGSQ-2025-005","","Por cumplir con las especificaciones técnicas solicitadas por la Institución","","2025-05-01T09:44:40-05:00","67200.00","USD","","","","","","","",""
"ocds-5wno2w-RE-PU-SRI-2025-80001-2438","RE-PU-SRI-2025-80001-2438-2025-06-03T15:38:57.742Z-compiled","7978990-RE-PU-SRI-2025-80001","","Por cumplir con lo establecido en los Términos de Referencias","","2025-04-22T16:02:23-05:00","29569.57","USD","","","","","","","",""
"ocds-5wno2w-RE-PU-HOSNAG-2025-002-2706","RE-PU-HOSNAG-2025-002-2706-2025-04-23T12:29:29.491Z-compiled","7986278-RE-PU-HOSNAG-2025-002","","POR CUMPLIR CON TODOS LOS PARAMETROS ESTABLECIDOS EN LOS PLIEGOS Y LAS ESPECIFICACIONES TECNICAS","","2025-04-16T14:33:01-05:00","7391.30","USD","","","","","","","",""
"ocds-5wno2w-RE-PU-HEJCA-2025-046-87497","RE-PU-HEJCA-2025-046-87497-2025-04-26T13:04:37.438Z-compiled","7975991-RE-PU-HEJCA-2025-046","","Cumple con la oferta técnica y económica","","2025-04-16T16:29:40-05:00","22207.40","USD","","","","","","","",""
"ocds-5wno2w-RE-PU-GADPR-TURI-2025-001-93749","RE-PU-GADPR-TURI-2025-001-93749-2025-05-01T12:36:08.723Z-compiled","7970411-RE-PU-GADPR-TURI-2025-001","","oferente cumple con lo requerido por entidad","","2025-04-22T11:02:50-05:00","47185.52","USD","","","","","","","",""
"ocds-5wno2w-RE-PU-GADC-2025-24082-2616","RE-PU-GADC-2025-24082-2616-2025-05-14T12:48:17.332Z-compiled","7979019-RE-PU-GADC-2025-24082","","POR CUMPLIR CON LAS ESPECIFICACIONES TÉCNICAS SOLICITADAS Y SER CONVENIENTE A LOS INTERESES INSTITUCIONALES","","2025-04-24T12:18:13-05:00","18845.80","USD","","","","","","","",""
"ocds-5wno2w-RE-PU-EPMMOP-2025-09-741823","RE-PU-EPMMOP-2025-09-741823-2025-08-22T18:38:04.960Z-compiled","7980741-RE-PU-EPMMOP-2025-09","","FAVOR REVISAR RESOLUCIÓN DE ADJUDICACIÓN","","2025-04-28T14:38:00-05:00","150000.00","USD","","","","","","","",""
"ocds-5wno2w-RE-PU-ARCONEL2025-007-1215959","RE-PU-ARCONEL2025-007-1215959-2025-05-01T12:36:08.447Z-compiled","7975020-RE-PU-ARCONEL2025-007","","CUMPLIMIENTO DE ESPECIFICACIONES TÉCNICAS Y ECONÓMICAS","","2025-04-15T15:37:35-05:00","15669.85","USD","","","","","","","",""
"ocds-5wno2w-RE-PU-ARCONEL2025-007-1215959","RE-PU-ARCONEL2025-007-1215959-2025-05-01T12:36:08.447Z-compiled","7975058-RE-PU-ARCONEL2025-007","","CUMPLIMIENTO DE ESPECIFICACIONES TÉCNICAS Y ECONÓMICAS","","2025-04-15T15:37:35-05:00","3700.00","USD","","","","","","","",""
"ocds-5wno2w-RE-PU-EPMMM-2025-002-585764","RE-PU-EPMMM-2025-002-585764-2025-05-07T12:36:36.329Z-compiled","7953441-RE-PU-EPMMM-2025-002","","Por reunir los requerimientos técnicos, económicos y legales exigidos en el pliego del proceso y convenir a los intereses institucionales.","","2025-04-08T16:59:27-05:00","5940.00","USD","","","","","","","",""
"ocds-5wno2w-RE-PU-EPMMM-2025-002-585764","RE-PU-EPMMM-2025-002-585764-2025-05-07T12:36:36.329Z-compiled","7953472-RE-PU-EPMMM-2025-002","","Por reunir los requerimientos técnicos, económicos y legales exigidos en el pliego del proceso y convenir a los intereses institucionales.","","2025-04-08T16:59:27-05:00","31545.00","USD","","","","","","","",""
"ocds-5wno2w-RE-PU-EPMMM-2025-002-585764","RE-PU-EPMMM-2025-002-585764-2025-05-07T12:36:36.329Z-compiled","7953481-RE-PU-EPMMM-2025-002","","Por reunir los requerimientos técnicos, económicos y legales exigidos en el pliego del proceso y convenir a los intereses institucionales.","","2025-04-08T16:59:27-05:00","84079.20","USD","","","","","","","",""
"ocds-5wno2w-RE-PU-SRI-2025-80002-2438","RE-PU-SRI-2025-80002-2438-2025-05-30T15:30:28.250Z-compiled","7990058-RE-PU-SRI-2025-80002","","Por cumplir con lo establecido en los términos de referenciad","","2025-04-21T13:40:21-05:00","230.00","USD","","","","","","","",""
"ocds-5wno2w-RE-PU-HCAM-2025-002-54651","RE-PU-HCAM-2025-002-54651-2025-05-01T12:36:05.730Z-compiled","7947481-RE-PU-HCAM-2025-002","","CUMPLE CON LO SOLICITADO POR ESTA CASA DE SALUD","","2025-04-03T16:42:44-05:00","599421.60","USD","","","","","","","",""
"ocds-5wno2w-RE-PU-ISSFA-2025-02-2803","RE-PU-ISSFA-2025-02-2803-2025-05-20T15:12:39.137Z-compiled","7988666-RE-PU-ISSFA-2025-02","","Por cumplir las condiciones técnicas establecidas en los pliegos. considerando lo establecido en el artículo 32 de laLey Orgánica del Sistema Nacional de Contratación Pública.","","2025-05-05T10:08:04-05:00","91390.00","USD","","","","","","","",""
"ocds-5wno2w-RE-PU-HEP-2025-00004-889479","RE-PU-HEP-2025-00004-889479-2025-06-18T16:59:07.175Z-compiled","7982771-RE-PU-HEP-2025-00004","","De conformidad a la Resolución Nro. MSP-CZ4-HEP-2025-0103-R, Artículo 1.- Acoger el resultado de la calificación de la compañía de la oferta técnica del proceso de Régimen Especial No. RE-PU-HEP-2025-00004, establecidas en el Acta de Calificación de Oferta Técnica del proceso de fecha 06 de mayo de 2025.","","2025-05-15T10:32:43-05:00","9765.00","USD","","","","","","","",""
"ocds-5wno2w-RE-PU-EPAAGE-MEJIA-2025-02-384004","RE-PU-EPAAGE-MEJIA-2025-02-384004-2025-04-04T12:52:45.221Z-compiled","7957712-RE-PU-EPAAGE-MEJIA-2025-02","","ADJUDICAR, el proceso No. RE-PU-EPAAGE-MEJIA-2025-02, para el?MANTENIMIENTO DE CAMIONETAS A DIESEL DE LA EPAAGE-MEJIA, EP?, a nombre del OferenteMETROCAR S.A., con RUC 1790258645001, por el valor de $ 5.000,00 Cinco Mil con 00/100 dólares delos Estados Unidos de América más IVA, con un plazo de ejecución de 180 días o hasta que se agote elvalor asignado a través de órdenes de servicio emitido por el administrador del contrato u orden de servicio.","","2025-04-03T16:13:35-05:00","5000.00","USD","","","","","","","",""
"ocds-5wno2w-RE-PU-DNPJ-2025-002-183304","RE-PU-DNPJ-2025-002-183304-2025-04-22T12:19:07.727Z-compiled","7982298-RE-PU-DNPJ-2025-002","","POR CUMPLIR CON LAS ESPECIFICACIONES TÉCNICAS Y PLIEGOS","","2025-04-21T16:51:56-05:00","14945.30","USD","","","","","","","",""
"ocds-5wno2w-RE-PU-MDMQ-2025-501-41357","RE-PU-MDMQ-2025-501-41357-2025-07-01T17:37:49.562Z-compiled","7984183-RE-PU-MDMQ-2025-501","","ADJUDICAR la ?CONTRATACIÓN DE LOS SERVICIOS DE MECÁNICAAUTOMOTRIZ PARA MANTENIMIENTO PREVENTIVO Y CORRECTIVO DE LOS VEHÍCULOSDE LA AZLD VIGENCIA TECNOLÓGICA al oferente AMBACAR CIA. LTDA. RUC 1890010705001,por cumplir integralmente con todos los parámetros de evaluación, por un valor de $35.439.64 TREINTA YCINCO MIL CUATROCIENTOS TREINTA Y NUEVE CON 64/100 DÓLARES DE LOS ESTADOSUNIDOS DE NORTEAMÉRICA valor sin IVA","","2025-04-22T09:35:12-05:00","35439.64","USD","","","","","","","",""
"ocds-5wno2w-RE-PU-CELECEP-2025-02183-238940","RE-PU-CELECEP-2025-02183-238940-2025-05-29T15:31:20.649Z-compiled","8002177-RE-PU-CELECEP-2025-02183","","EN BASE A RESOLUCION EGU RES 0130 25 SUSCRITA POR EL GERENTE DE UNIDAD DE NEGOCIO DONDE RESUELVE EN ARTICULO 2 ADJUDICAR LA CONTRATACION AL OFERENTE ASTAP CÍA. LTDA.","","2025-05-28T15:27:01-05:00","296590.00","USD","","","","","","","",""
"ocds-5wno2w-RE-PU-CCQA-HDA-2025-002-97105","RE-PU-CCQA-HDA-2025-002-97105-2025-04-25T12:47:13.947Z-compiled","7983282-RE-PU-CCQA-HDA-2025-002","","Por cumplir con los requisitos mínimos solicitados en el pliego además de encontrarse debidamente habilitado en el Sistema Oficial de Contratación Pública.","","2025-04-16T19:04:24-05:00","8470.00","USD","","","","","","","",""
"ocds-5wno2w-RE-PU-SZC3-2025-001-180186","RE-PU-SZC3-2025-001-180186-2025-05-02T12:29:16.704Z-compiled","7992302-RE-PU-SZC3-2025-001","","Conforme Art. 32 de la LOSNCP","","2025-04-24T15:09:15-05:00","10059.51","USD","","","","","","","",""
"ocds-5wno2w-RE-PU-IESS-2025-00003-39594","RE-PU-IESS-2025-00003-39594-2025-05-16T12:48:52.503Z-compiled","7981609-RE-PU-IESS-2025-00003","","Por cumplir con los requisitos mínimos solicitados en el pliego, además de encontrarse debidamente habilitado en el Sistema Oficial de Contratación Pública.","","2025-05-01T08:24:07-05:00","15229.08","USD","","","","","","","",""
"ocds-5wno2w-RE-PU-MTS-EP-2025-001-779303","RE-PU-MTS-EP-2025-001-779303-2025-05-16T12:48:49.398Z-compiled","7988933-RE-PU-MTS-EP-2025-001","","Por haber cumplido con todos los requerimientos técnicos y legales establecidos en el pliego precontractual y convenir a los intereses institucionales. De acuerdo al Informe de Recomendación INFORME Nro. 001-RTV-RC-MTS-EP-2025 y Resolución de Adjudicación No. 001-2025.","","2025-04-25T16:22:19-05:00","70410.04","USD","","","","","","","",""
"ocds-5wno2w-002-67972","002-67972-2025-06-18T16:56:56.170Z-compiled","7990082-002","","Art. 1.- ADJUDICAR el proceso de Codigo Nro. RE-PU-HAIAM-2025-002, cuyo objeto es la ADQUISICIÓN DE NC. DISPOSITIVOS MEDICOS, SETS PARA BOMBA DE INFUSION COMPATIBLES CON BOMBAS VOLUMAT AGUILA PARA USO EN PACIENTES DEL HOSPITAL DE ATENCION INTEGRAL DEL ADULTO MAYOR 2025, al oferente FRESENIUS KABI S.A. con RUC. 0991312080001, de conformidad con los pliegos y demas documentos del proceso, por un valor USD 18.154,82 DIECIOCHO MIL CIENTO CINCUENTA Y CUATRO CON 82 100 DOLARES DE LOS ESTADOS UNIDOS DE AMERICA sin incluir IVA, con un plazo de ejecucion de 10 dias calendarios contados a partir de la firma del contrato.","","2025-04-24T15:27:41-05:00","18154.82","USD","","","","","","","",""
"ocds-5wno2w-RE-PU-CMFIEDM-2025-002-748941","RE-PU-CMFIEDM-2025-002-748941-2025-04-12T13:20:21.205Z-compiled","7964407-RE-PU-CMFIEDM-2025-002","","De conformidad con lo dispuesto en los artículos 132 y 197 del Reglamento General a Ley Orgánica del Sistema Nacional de Contratación Pública y, en uso de las atribuciones conferidas por la Resolución Administrativa Nro. IESS-DG-DR-2018-008-RFDQ, de 21 de noviembre de 2018","","2025-04-11T14:08:57-05:00","8436.00","USD","","","","","","","",""
"ocds-5wno2w-RE-PU-ESPE-2025-001-30573","RE-PU-ESPE-2025-001-30573-2025-05-20T15:12:40.312Z-compiled","7986042-RE-PU-ESPE-2025-001","","Cumple lo solicitado en los pliegos","","2025-04-24T14:29:02-05:00","55000.00","USD","","","","","","","",""
"ocds-5wno2w-RE-PU-GADMATACAMES-2025-0001-20080","RE-PU-GADMATACAMES-2025-0001-20080-2025-06-06T15:46:17.037Z-compiled","7980439-RE-PU-GADMATACAMES-2025-0001","","CUMPLE CON LO REQUERIDO POR LA INSTITUCIÓN","","2025-04-16T12:15:48-05:00","86147.82","USD","","","","","","","",""
"ocds-5wno2w-RE-PU-DD10D02AAOS-2025-02-574800","RE-PU-DD10D02AAOS-2025-02-574800-2025-06-24T17:04:35.516Z-compiled","7996475-RE-PU-DD10D02AAOS-2025-02","","CUMPLE CON LOS REQUISITOS Y PARAMETROS MINIMOS REQUERIDOS","","2025-04-30T16:41:14-05:00","2810.00","USD","","","","","","","",""
"ocds-5wno2w-RE-PU-DD10D02AAOS-2025-02-574800","RE-PU-DD10D02AAOS-2025-02-574800-2025-06-24T17:04:35.516Z-compiled","7996541-RE-PU-DD10D02AAOS-2025-02","","CUMPLE CON LOS REQUISITOS Y PARAMETROS MINIMOS REQUERIDOS","","2025-04-30T16:41:14-05:00","1700.00","USD","","","","","","","",""
"ocds-5wno2w-RE-PU-GADPP-2025-3-2426","RE-PU-GADPP-2025-3-2426-2025-09-09T20:05:52.109Z-compiled","7951013-RE-PU-GADPP-2025-3","","por cumplir con la presentación de los requisitos solicitados en el pliego y TDRS","","2025-03-27T19:38:53-05:00","103000.00","USD","","","","","","","",""
"ocds-5wno2w-RE-PU-14D04SALUD-2025-002-13011","RE-PU-14D04SALUD-2025-002-13011-2025-05-08T12:36:22.829Z-compiled","7983853-RE-PU-14D04SALUD-2025-002","","Cumple con los requisitos solicitados en el pliego.","","2025-04-25T14:23:52-05:00","8071.66","USD","","","","","","","",""
"ocds-5wno2w-RE-PU-FGE-FPDO-UAF-2025-0009-75428","RE-PU-FGE-FPDO-UAF-2025-0009-75428-2025-04-08T12:54:06.105Z-compiled","7971833-RE-PU-FGE-FPDO-UAF-2025-0009","","SERVICIOS DE MANTENIMIENTO Y REPARACION DE ASCENSORES, DISPOSITIVOS PARA ELEVAR BULTOS, ESCALERAS MECANICAS Y PAVIMENTOS MOVILES MANTENIMIENTO DE DOS ASCNESORES Y UNA ESCALERA ELECTRICA DEL EDIFICIO FPDO MACHA","","2025-04-07T15:03:16-05:00","7842.00","USD","","","","","2025-04-08T00:00:00-05:00","2026-02-06T00:00:00-05:00","","304"
"ocds-5wno2w-RE-PU-EPCBM-2025-00001-367572","RE-PU-EPCBM-2025-00001-367572-2025-05-06T12:31:57.615Z-compiled","7990045-RE-PU-EPCBM-2025-00001","","EL PROVEEDOR CUMPLIÓ CON TODO LO SOLICITADO EN LOS PLIEGOS Y TDR POR LA ENTIDAD CONTRATANTE.","","2025-05-05T15:43:38-05:00","15200.00","USD","","","","","","","",""
"ocds-5wno2w-RE-PU-FG-2025-001-71731","RE-PU-FG-2025-001-71731-2025-05-20T15:12:41.420Z-compiled","7992280-RE-PU-FG-2025-001","","Resolución 31-FPG-2025 Art. 1.- ADJUDICAR el proceso de contratación por el procedimiento de ?Régimen Especial-Proveedor Único?, para el ?SERVICIO DE MANTENIMIENTO PREVENTIVO Y CORRECTIVO DATA CENTER DEL EDIFICIO MONTECRISTI DE LA FISCALIA DEL GUAYAS?, signado con el código RE-PU-FG-2025-001 con un presupuesto de USD$ 7.200.00 siete mil doscientos 00/100 dólares de los Estados Unidos de Norteamérica más IVA, por un plazo de ejecución de 365 días contados a partir del día siguiente de la suscripción del contrato, a favor de la empresa KARPATTY TECNOLOGÍAS CIA.LTDA. con RUC 1792844576001","","2025-04-29T14:33:32-05:00","7200.00","USD","","","","","","","",""
"ocds-5wno2w-RE-PU-ESANMA-2025-0001-16208","RE-PU-ESANMA-2025-0001-16208-2025-05-21T15:10:07.850Z-compiled","8002549-RE-PU-ESANMA-2025-0001","","CUMPLE CON TODO LO REQUERIDO","","2025-04-30T10:51:00-05:00","3192.51","USD","","","","","","","",""
"ocds-5wno2w-RE-PU-CCENPG-2025-0001-158042","RE-PU-CCENPG-2025-0001-158042-2025-04-22T12:19:08.052Z-compiled","7991053-RE-PU-CCENPG-2025-0001","","SE ADJUDICA CCE-CCENIG-2025-0324-M","","2025-04-21T10:29:19-05:00","6000.00","USD","","","","","","","",""
"ocds-5wno2w-RE-PU-UTM-2025-0002-41046","RE-PU-UTM-2025-0002-41046-2025-06-17T16:51:47.247Z-compiled","7996085-RE-PU-UTM-2025-0002","","POR CONVENIR A LOS INTERESES INSTITUCIONALES","","2025-04-30T18:01:08-05:00","11637.84","USD","","","","","","","",""
"ocds-5wno2w-RE-PU-CCENPG-2025-0003-158042","RE-PU-CCENPG-2025-0003-158042-2025-04-17T12:25:53.514Z-compiled","7985806-RE-PU-CCENPG-2025-0003","","RESOLUCIÓN DE ADJUDICACIÓN CCE-CCENIG-2025-0041-R","","2025-04-16T18:37:34-05:00","10080.00","USD","","","","","","","",""
"ocds-5wno2w-RE-PU-CEE-2025-001-2504","RE-PU-CEE-2025-001-2504-2025-04-26T13:05:58.793Z-compiled","7995865-RE-PU-CEE-2025-001","","cumple","","2025-04-25T16:57:33-05:00","176132.34","USD","","","","","","","",""
"ocds-5wno2w-RE-PU-GADPIFO-2025-01-89855","RE-PU-GADPIFO-2025-01-89855-2025-04-08T12:54:50.901Z-compiled","7976935-RE-PU-GADPIFO-2025-01","","Cumple con lo especificado en los TDR y Pliegos","","2025-04-07T19:06:17-05:00","1292.44","USD","","","","","","","",""
"ocds-5wno2w-RE-PU-GADM-IBARRA-2025-002-2783","RE-PU-GADM-IBARRA-2025-002-2783-2025-05-07T12:37:57.301Z-compiled","7990217-RE-PU-GADM-IBARRA-2025-002","","DE CONFORMIDAD CON EL INFORME DE RECOMENDACION EMITIDO POR LA DELEGADA Y CON LA RESOLUCION DE ADJUDICACION EMITIDA POR LA MAXIMA AUTORIDAD","","2025-05-06T15:46:31-05:00","50000.00","USD","","","","","","","",""
"ocds-5wno2w-RE-PU-MEF-2025-001-2468","RE-PU-MEF-2025-001-2468-2025-04-17T12:24:46.208Z-compiled","7960785-RE-PU-MEF-2025-001","","RESOLUCION ADJUDICACION 037","","2025-04-08T20:15:53-05:00","24914.54","USD","","","","","","","",""
"ocds-5wno2w-RE-PU-CCENPG-2025-0002-158042","RE-PU-CCENPG-2025-0002-158042-2025-04-22T12:19:08.080Z-compiled","7991083-RE-PU-CCENPG-2025-0002","","SE ADJUDICA A PROVEEDOR MEDIANTE RESOLUCION CCE-CCENIG-2025-0044-R","","2025-04-21T22:50:13-05:00","12000.00","USD","","","","","","","",""
"ocds-5wno2w-RE-PU-SZC3-2025-00002-180186","RE-PU-SZC3-2025-00002-180186-2025-05-02T12:29:17.722Z-compiled","7998179-RE-PU-SZC3-2025-00002","","Cumple con todos los requisitos solicitados en los Términos de Referencia y pliegos y conviene a los intereses institucionales.","","2025-04-24T16:40:56-05:00","21754.74","USD","","","","","","","",""
"ocds-5wno2w-RE-PU-HEEE-2025-005-52558","RE-PU-HEEE-2025-005-52558-2025-06-13T16:11:27.019Z-compiled","8006549-RE-PU-HEEE-2025-005","","ADJUDICAR el proceso de Régimen Especial –Proveedor Único, signado con el código Nro.RE-PU-HEEE-2025-005, cuyo objeto es la ?ADQUISICION DEL MEDICAMENTO ALECTINIBSOLIDO ORAL 150 MG PARA EL HOSPITAL DE ESPECIALIDADES EUGENIO ESPEJO?, a laempresa ROCHE ECUADOR S.A., con RUC Nro. 1790475689001, por un valor de USD 309.859,20TRESCIENTOS NUEVE MIL OCHOCIENTOS CINCUENTA Y NUEVE CON 20/100 DÓLARES DE LOSESTADOS UNIDOS DE AMERICA más IVA 0%.","","2025-04-30T10:20:49-05:00","309859.20","USD","","","","","","","",""
"ocds-5wno2w-RE-PU-HEEE-2025-006-52558","RE-PU-HEEE-2025-006-52558-2025-06-19T16:55:33.155Z-compiled","8014146-RE-PU-HEEE-2025-006","","ADJUDICADO SEGUN RESOLUCION MSP-CZ9-HEEE-2025-0048-R","","2025-04-29T08:05:20-05:00","570000.00","USD","","","","","","","",""
"ocds-5wno2w-RE-PU-HIESSRI-2025-001-2561","RE-PU-HIESSRI-2025-001-2561-2025-05-16T12:48:54.602Z-compiled","7996887-RE-PU-HIESSRI-2025-001","","Adjudicar el proceso de Régimen Especial Nro.  RE-PU-HIESSRI-2025-001 para la ?ADQUISICIÓN DE REPUESTOS Y ACCESORIOS PARA EQUIPOS MÉDICOS EXCLUSIVOS DE LA MARCA LEISTUNG DEL SERVICIO DE NEONATOLOGÍA DEL HOSPITAL GENERAL RIOBAMBA?, al oferente: ANGEL-VILLACRES S.A.S., con RUC: 0993367147001, por cuanto cumple con todos los requerimientos técnicos y legales","","2025-04-23T16:25:36-05:00","152725.51","USD","","","","","","","",""
"ocds-5wno2w-RE-PU-UEB-2025-01-69741","RE-PU-UEB-2025-01-69741-2025-04-24T12:47:36.073Z-compiled","7996585-RE-PU-UEB-2025-01","","De conformidad al Informe de Recomendación deAdjudicación suscrito por la Comisión Técnica designada para llevara cabo la faseprecontractual del presente procedimiento y en virtud de haber cumplido con todo losaspectos técnicos, legales y económicos establecidos en el proceso de conformidad lo queestablece la Ley Orgánica del Sistema Nacional de Contratación Pública, su Reglamento,Resoluciones emitidas para el efecto por el Servicio Nacional de Contratación Pública ydemás normativa referente a contratación pública.","","2025-04-23T17:42:07-05:00","230078.76","USD","","","","","","","",""
"ocds-5wno2w-RE-PU-UEA-2025-003-124342","RE-PU-UEA-2025-003-124342-2025-05-21T15:10:14.938Z-compiled","7997878-RE-PU-UEA-2025-003","","CUMPLE CON LOS PARÁMETROS ESTABLECIDOS EN LOS PLIEGOS","","2025-04-29T18:02:01-05:00","19992.00","USD","","","","","","","",""
