"ocid","id","rationale","budget_id","budget_description","budget_amount","budget_currency"
"ocds-5wno2w-RE-PU-ESPOL-2025-012-26822","RE-PU-ESPOL-2025-012-26822-2025-09-18T19:28:50.971Z-compiled","ADQUISICIÓN DE UN ESPECTROFOTÓMETRO DE ABSORCIÓN ATÓMICA CONLLAMA Y HORNO DE GRAFITO CON CORRECTOR DE FONDO MEDIANTE EFECTOZEEMAN Y DEUTERIO PARA LLAMA PARA EL LABORATORIO ECOTOXICOLOGÍADE LA FACULTAD DE CIENCIAS DE LA VIDA DE LA ESCUELA SUPERIOR","2025.167.0000.0000.82.00.002.001.000.0901.840104.000000.202.8888.8888-91670000.217.2656","","107200.00","USD"
"ocds-5wno2w-RE-PU-DIGMAT-2025-009-2465","RE-PU-DIGMAT-2025-009-2465-2025-10-08T19:43:44.617Z-compiled","MANTENIMIENTO PREVENTIVO Y CORRECTIVO DE LOS DISPOSITIVOS CONDOR SKY SEEKER DE LA ARMADA DEL ECUADOR","2025.070.3022.0000.91.00.000.008.000.0901.530410.000000.001.0000.0000-","","29769.74","USD"
"ocds-5wno2w-RE-PU-CZ1S-2025-002-423779","RE-PU-CZ1S-2025-002-423779-2025-10-04T19:09:30.717Z-compiled","Adquirir repuestos y accesorios para realizar el mantenimiento preventivo del equipo Analizador de QuímicaSanguínea marca Miura modelo AUTOANALYZER VERS serie H1893, con la finalidad de proporcionar un servicio de calidad, eficiencia y efectividad","2025.320.0051.0000.55.00.000.004.000.1001.530404.000000.001.0000.0000-","","8093.12","USD"
"ocds-5wno2w-RE-PU-SRI-2025-00008-2438","RE-PU-SRI-2025-00008-2438-2025-10-04T19:09:30.685Z-compiled","MANTENIMIENTO Y SOPORTE TÉCNICO DELSISTEMA DE GESTIÓN DE TURNOS QMATIC","2025.135.0000.0000.01.00.000.001.000.1701.530404.000000.001.0000.0000-","","399720.00","USD"
"ocds-5wno2w-RE-PU-EMMAIPC-2025-002-388889","RE-PU-EMMAIPC-2025-002-388889-2025-10-09T19:37:22.129Z-compiled","MANTENIMIENTO DE LA MINICARGADORA 1DE LA EMMAIPC-EP","7.3.08.037.3.08.13","","25421.30","USD"
"ocds-5wno2w-RE-PU-HAGP-2025-007-17993","RE-PU-HAGP-2025-007-17993-2025-10-14T20:01:30.132Z-compiled","ADQUISICIÓN DE OCRELIZUMAB LÍQUIDO PARENTERAL 30MG/ML CAJA X VIAL PARA EL HOSPITAL DE ESPECIALIDADES GUAYAQUIL ?DR. ABEL GILBERTPONTÓN? PARA SEIS MESES AÑO 2025","2025.320.1192.0000.58.00.000.005.000.0901.530809.000000.003.0000.0000-","","79112.70","USD"
"ocds-5wno2w-RE-PU-GADC-2025-3254-2616","RE-PU-GADC-2025-3254-2616-2025-09-30T19:05:11.982Z-compiled","RENOVACIÓN DE LICENCIAMIENTO Y SOPORTE ORACLE","8.1.11.4.01.07","","145850.73","USD"
"ocds-5wno2w-RE-PU-IAEN-2025-004-2575","RE-PU-IAEN-2025-004-2575-2025-10-02T19:08:46.951Z-compiled","SUSCRIPCIÓN DE METABUSCADOR DE DESCUBRIMIENTO DE EBSCO, AUTENTICACION LOOKPROXY PARA EL INSTITUTO DE ALTOS ESTUDIOS NACIONALES","2025.232.0000.0000.83.00.000.001.000.1701.530702.000000.002.7001.0060-","","22000.00","USD"
"ocds-5wno2w-RE-PU-SNGR-2025-001-16616","RE-PU-SNGR-2025-001-16616-2025-10-08T19:43:42.779Z-compiled","RENOVACIÓN DE LICENCIAS ENVI, QUE INCLUYA ACCESO A IMÁGENES SATELITALES ÓPTICAS Y RADAR, BAJO DEMANDA PARA APLICACIONES EN GESTIÓN DE RIESGOS","2025.034.9999.0000.57.00.005.001.000.0916.730702.000000.202.8888.8888-30340000.0000.387104","","210000.00","USD"
"ocds-5wno2w-RE-PU-ESNAQI-2025-002-2554","RE-PU-ESNAQI-2025-002-2554-2025-10-02T19:07:13.238Z-compiled","MANTENIMIENTO PREVENTIVO Y CORRECTIVO POR VIGENCIA TECNOLÓGICA DEL VEHÍCULO FORD PERTENECIENTE A LA ARMADA DEL ECUADOR","2025.070.3028.0000.01.00.000.001.000.1701.530405.000000.002.0000.0000-","","4925.08","USD"
"ocds-5wno2w-RE-PU-EPUNEMI-2025-001-474763","RE-PU-EPUNEMI-2025-001-474763-2025-10-03T19:15:16.941Z-compiled","CONTRATACIÓN DEL SERVICIO ANUAL DE SUSCRIPCIÓN A LA BASE DE DATOS SCOPUS+SCIVAL PARA EL DESARROLLO DE INVESTIGACIÓN CIENTÍFICA EN LA UNIVERSIDAD ESTATAL DE MILAGRO","530702","","39500.00","USD"
"ocds-5wno2w-RE-PU-UTC-2025-003-2671","RE-PU-UTC-2025-003-2671-2025-09-25T19:01:06.064Z-compiled","CONTRATACIÓN ANUAL DE 30 LICENCIAS DEL SOFTWARE ESTADÍSTICO SPSS PARA ELLABORATORIO DE LA CARRERA DE ECONOMÍA EN LA UNIVERSIDAD TÉCNICA DE COTOPAXI","2025.179.0000.0000.82.00.000.003.000.0501.530702.000000.003.0000.0000-","","13278.00","USD"
"ocds-5wno2w-RE-PU-CGE-2025-001-35516","RE-PU-CGE-2025-001-35516-2025-09-25T19:01:06.092Z-compiled","MANTENIMIENTO PREVENTIVO, CORRECTIVO Y ATENCIÓN ALLAMADAS DE EMERGENCIA DE LOS ASCENSORES HUBSCHMANN RHEIN DE LASDIRECCIONES PROVINCIALES DE GUAYAS, IMBABURA, LOJA Y TUNGURAHUA DE LA CGE","530404","","14400.00","USD"
"ocds-5wno2w-RE-PU-UEA-2025-007-124342","RE-PU-UEA-2025-007-124342-2025-10-04T19:09:30.561Z-compiled","CONTRATACIÓN DE LICENCIAS ACADÉMICAS PARA EL USO DE LA HERRAMIENTA ANTIPLAGIO TURNITIN - DOCUMENTOS ILIMITADOS E INTEGRACIÓN LMS PARA LA UNIVERSIDAD ESTATAL AMAZÓNICA","2025.185.0000.0000.82.00.000.001.000.1601.530702.000000.001.0000.0000-","","25000.00","USD"
"ocds-5wno2w-RE-PU-ESPAMMFL-2025-04-25643","RE-PU-ESPAMMFL-2025-04-25643-2025-10-07T19:41:27.809Z-compiled","CONTRATACIÓN DELSERVICIO PARA LA SUSCRIPCIÓN BIANUAL A LA BIBLIOTECA VIRTUAL ELIBRO, DE LIBROSDIGITALES ACADÉMICOS PARA LA ESCUELA SUPERIOR POLITÉCNICA AGROPECUARIA DEMANABÍ MANUEL FÉLIX LÓPEZ","2025.188.0000.0000.82.00.000.001.000.1302.530702.000000.001.0000.0000-","","17304.00","USD"
"ocds-5wno2w-RE-PU-IAEN-2025-003-2575","RE-PU-IAEN-2025-003-2575-2025-10-07T19:41:27.445Z-compiled","SUSCRIPCIÓN DE LA BASE DE DATOS TAYLOR & FRANCIS PARA EL INSTITUTO DE ALTOS ESTUDIOS NACIONALES","2025.232.0000.0000.83.00.000.001.000.1701.530702.000000.002.7001.0060-","","16100.88","USD"
"ocds-5wno2w-RE-PU-BDE-2025-003-2435","RE-PU-BDE-2025-003-2435-2025-10-04T19:10:49.842Z-compiled","SERVICIO DEL SISTEMA ELECTRÓNICO BURSÁTIL REDEVAL","530702","","11400.00","USD"
"ocds-5wno2w-RE-PU-CEN-2025-004-715112","RE-PU-CEN-2025-004-715112-2025-10-17T19:47:54.040Z-compiled","CONTRATAR EL SERVICIO DEL MANTENIMIENTO DEL SISTEMA SPS","2025.095.9999.0000.55.00.000.001.000.1701.530704.000000.002.0000.0000-","","189000.00","USD"
"ocds-5wno2w-RE-PU-PG-2025-002-31125","RE-PU-PG-2025-002-31125-2025-10-15T20:12:20.365Z-compiled","PARTICIPACIÓN EN EL EVENTO HORECA FEST 2025 HOTELES, RESTAURANTES Y CAFETERÍAS","730249","","70000.00","USD"
"ocds-5wno2w-RE-PU-UITEY-2025-008-541976","RE-PU-UITEY-2025-008-541976-2025-10-07T19:41:28.343Z-compiled","Actualización de licencias ENVI para uso en la Escuela de Ciencias de la Tierra, Energía y Ambiente de la Universidad de Investigación de Tecnología Experimental Yachay","2025.183.0000.0000.83.00.000.001.000.1006.530702.000000.003.0000.0000-","","7213.00","USD"
"ocds-5wno2w-RE-PU-IKIAM-2025-008-599302","RE-PU-IKIAM-2025-008-599302-2025-10-01T19:09:22.849Z-compiled","Mantenimiento preventivo y correctivo, con repuestos, para los equipos analíticos Shimadzu del LNRA y LPN de la URAI","2025.087.9999.0000.83.00.000.003.000.1501.530606.000000.003.0000.0000-","","58490.00","USD"
"ocds-5wno2w-RE-PU-RDP-2025-0002-109432","RE-PU-RDP-2025-0002-109432-2025-10-15T20:15:48.130Z-compiled","ADQUISICIÓN DE 12 TARJETAS SGCT PARA VARIADOR E DEL SISTEMA ACUEDUCTO LA ESPERANZA - RDP","840111","","194020.08","USD"
"ocds-5wno2w-RE-PU-UTC-2025-004-2671","RE-PU-UTC-2025-004-2671-2025-10-08T19:45:22.135Z-compiled","ARRENDAMIENTO DE LICENCIA DE UN SISTEMA PARA VERIFICAR LA SIMILITUD DE CONTENIDOACADÉMICO Y DE INVESTIGACIÓN DE LA UNIVERSIDAD TÉCNICA DE COTOPAXI POR UN AÑO","2025.179.0000.0000.01.00.000.002.000.0501.530255.000000.002.7001.0048-","","13378.00","USD"
"ocds-5wno2w-RE-PU-GADMCPZ-2025-027-2345","RE-PU-GADMCPZ-2025-027-2345-2025-10-02T19:07:12.351Z-compiled","SERVICIO DE MANTENIMIENTO PREVENTIVO Y CORRECTIVO PARA LA BUSETA JAC HFC COASTER CON GARANTÍA TÉCNICA DEL FABRICANTE Y VIGENCIA TECNOLÓGICA, PERTENECIENTE AL GADM-PASTAZA","360.730405.000","","7392.47","USD"
"ocds-5wno2w-RE-PU-DHG-2025-010-5702","RE-PU-DHG-2025-010-5702-2025-10-17T19:46:33.761Z-compiled","CONTRATACIÓN DEL SERVICIO DE MANTENIMIENTO ANUAL PREVENTIVO Y CORRECTIVO CON REPUESTOS DEL SISTEMA GENERADOR Y DISTRIBUIDOR DE VAPOR CALDERO MARCA SUPERIOR DE 150 BHP DE LA DHG","2025.058.0002.0000.91.00.000.001.000.0901.530404.000000.002.0000.0000-","","68693.50","USD"
"ocds-5wno2w-RE-PU-HCAM-2025-036-54651","RE-PU-HCAM-2025-036-54651-2025-10-13T19:43:07.923Z-compiled","ADQUISICIÓN DE REPUESTOS Y MANTENIMIENTO PREVENTIVO Y CORRECTIVO DE LAS CAMILLAS LOS PINOS PERTENECIENTES AL HOSPITAL DE ESPECIALIDADES CARLOS ANDRADE MARÍN","530813-530404","","145800.00","USD"
"ocds-5wno2w-RE-PU-DD14D03S-2025-21-76040","RE-PU-DD14D03S-2025-21-76040-2025-10-15T20:17:28.088Z-compiled","Servicio de Mantenimiento Preventivo y Correctivo de la Camioneta GREAT WALL Placa NEA1244 de la Dirección Distrital 14D03 - Logroño - Sucúa - Salud del Proyecto Interculturalidad","2025.320.1365.0000.55.00.000.005.000.1406.530105.000000.001.0000.0000-","","1521.14","USD"
"ocds-5wno2w-RE-PU-GADM-2025-01-31689","RE-PU-GADM-2025-01-31689-2025-10-16T20:09:53.812Z-compiled","CONTRATACIÓN DEL SERVICIO DE ABASTECIMIENTO DE COMBUSTIBLE DIÉSEL 2 INDUSTRIAL PARA MAQUINARIA PESADA DE PROPIEDAD DEL GADC MIRA","361.7.3.02.55.003","","87520.80","USD"
"ocds-5wno2w-RE-PU-GADPP-2025-21-2426","RE-PU-GADPP-2025-21-2426-2025-09-30T19:08:29.451Z","Servicio de participación del Gobierno Autónomo Descentralizado de la Provincia de Pichincha en el Evento Ecuestre de la Copa Pichincha Latitud 0","06.36.42.734.001.2025.730249.001.17.01.50.D21.9999","","35000.00","USD"
"ocds-5wno2w-RE-PU-UTA-2025-006-3205","RE-PU-UTA-2025-006-3205-2025-09-30T19:08:24.067Z-compiled","CONTRATACIÓN DEL SERVICIO DE SUSCRIPCIÓN A LA BASE DE DATOS CIENTÍFICA SCOPUS PARA EL USO ACADÉMICO, INVESTIGATIVO Y BIBLIOGRÁFICO DE LA UNIVERSIDAD TÉCNICA DE AMBATO","2025.176.9999.0000.82.00.000.004.000.1801.531403.000000.002.7001.0045-","","20000.00","USD"
"ocds-5wno2w-RE-PU-UPSE-2025-004-81550","RE-PU-UPSE-2025-004-81550-2025-10-09T19:38:33.539Z-compiled","SERVICIO DE RENOVACIÓN DE LICENCIA DE ACCESO Y USO DE BASE DE DATOS MULTIDISCIPLINARIA: ELIBRO, COLECCIÓN ESPAÑOL UPSE, PARA LA UNIVERSIDAD ESTATAL PENÍNSULA DE SANTA ELENA","2025.187.9999.0000.82.00.000.001.000.2402.530702.000000.001.0000.0000-","","12638.25","USD"
"ocds-5wno2w-RE-PU-EPP-2025-017-253178","RE-PU-EPP-2025-017-253178-2025-10-01T19:09:18.623Z-compiled","ADQUISICIÓN DE REPUESTOS PARA MEDIDORES DE FLUJO PARA DESPACHO DE COMBUSTIBLE","E1GA1152102MSO01318022119101000000000000","","398367.00","USD"
"ocds-5wno2w-RE-PU-DMG-Z8-2025-003-387997","RE-PU-DMG-Z8-2025-003-387997-2025-10-17T19:48:12.785Z-compiled","MANTENIMIENTO PREVENTIVO Y CORRECTIVO DE LAS MOTOCICLETAS MARCA HONDA MODELO XRE-300 CON VIGENCIA TECNOLÓGICA DEL DISTRITO METROPOLITANO DE GUAYAQUIL ZONA 8","2025.052.0085.0000.01.00.000.001.000.0901.530104.000000.001.0000.0000-","","531558.31","USD"
"ocds-5wno2w-RE-PU-EPMGDT-2025-001-264472","RE-PU-EPMGDT-2025-001-264472-2025-10-14T20:04:53.360Z-compiled","SUSCRIPCIÓN DE NUEVOS COMPONENTES AL SERVICIO DE PROVISIÓNDE DATOS EN LÍNEA PARA LA GESTIÓN DE SERVICIOS DEINTELIGENCIA TURÍSTICA PARA EL DMQ?,","730702","","177950.00","USD"
"ocds-5wno2w-RE-PU-UNAMYDESC-2025-001-361280","RE-PU-UNAMYDESC-2025-001-361280-2025-10-03T19:10:06.486Z-compiled","CONTRATACIÓN DE ACTUALIZACIÓN DEL SISTEMAINFORMATICO DEL CENTRO DE MEDICO DE UNAMYDESC","53.07.01.00","","1700.00","USD"
"ocds-5wno2w-RE-PU-HEJCA-2025-328-87497","RE-PU-HEJCA-2025-328-87497-2025-10-14T20:04:53.224Z-compiled","ADQUISICIÓN DE RISDIPLAM SÓLIDO ORAL POLVO 0,75 MG/ML","530809","","295512.96","USD"
"ocds-5wno2w-RE-PU-UG-2025-005-55840","RE-PU-UG-2025-005-55840-2025-10-15T20:15:48.370Z-compiled","CONTRATACIÓN DEL SERVICIO DE SUSCRIPCIÓN A BASE CIENTÍFICA SCOPUS PARA LA COORDINACIÓN DE INVESTIGACIÓN DE LA UNIVERSIDAD DE GUAYAQUIL","2025.166.0000.0000.01.00.000.006.000.0901.530702.000000.001.0000.0000-","","35193.00","USD"
"ocds-5wno2w-RE-PU-HLGD-2025-001-93666","RE-PU-HLGD-2025-001-93666-2025-10-16T20:09:53.838Z-compiled","CONTRATACIÓN POR RÉGIMEN ESPECIAL DE LA ?ADQUISICIÓN DEDIESEL INDUSTRIAL 2 PARA CALDEROS Y GENERADORES DEL HOSPITAL LUIS G. DAVILA","2025.320.1070.0000.90.00.000.004.000.0401.530255.000000.001.0000.0000-","","30070.94","USD"
"ocds-5wno2w-RE-PU-UC-2025-004-30951","RE-PU-UC-2025-004-30951-2025-10-14T20:04:50.330Z-compiled","CONTRATACIÓN DEL SERVICIO DE SUSCRIPCIÓN AL PROGRAMA DE FORMACIÓN DE PROFESORES Y PERSONAL Y ODILO UNIVERSITY","2025.161.0000.0000.01.00.000.004.000.0101.530702.000000.002.7001.0004-","","23100.00","USD"
"ocds-5wno2w-RE-PU-UITEY-2025-011-541976","RE-PU-UITEY-2025-011-541976-2025-10-14T20:06:56.666Z-compiled","Adquisición de un Texturómetro de Alta Precisión para el Fortalecimiento de las Capacidades de Docencia e Investigación en la Carrera de Ciencias Agropecuarias y Agroindustriales de la Universidad de Investigación de Tecnología Experimental Yachay","2025.183.0000.0000.83.00.000.001.000.1006.840104.000000.003.0000.0000-","","44223.15","USD"
"ocds-5wno2w-RE-PU-HOSNAG-2025-008-2706","RE-PU-HOSNAG-2025-008-2706-2025-10-15T20:17:28.780Z-compiled","ADQUISICIÓN DE 252 UNIDADES DEL MEDICAMENTO RIBOCICLIB SÓLIDO ORAL 200 MG, QUE NO CONSTA EN EL CUADRO NACIONAL DE MEDICAMENTOS BÁSICOS VIGENTE","2025.070.3030.0000.92.00.000.003.000.0901.530809.000000.002.0000.0000-","","11886.84","USD"
"ocds-5wno2w-RE-PU-UPSE-2025-003-81550","RE-PU-UPSE-2025-003-81550-2025-10-17T19:46:33.981Z-compiled","SERVICIO DE LICENCIAS SCOPUS, SCOPUS AI, SCIVAL Y SPRINGER JOURNAL CON FINES DE INVESTIGACIÓN PARA LA BIBLIOTECA VIRTUAL DE LA UNIVERSIDAD ESTATAL PENÍNSULA DE SANTA ELENA","2025.187.9999.0000.83.00.000.001.000.2402.530702.000000.001.0000.0000-","","88924.00","USD"
"ocds-5wno2w-RE-PU-ASMC-2025-002-124475","RE-PU-ASMC-2025-002-124475-2025-10-14T20:07:03.988Z-compiled","SERVICIO TECNOLÓGICO DE MANTENIMIENTO DEL VEHÍCULO DE LA UNIDAD QUIRURGICA MOVIL","730405","","40558.27","USD"
"ocds-5wno2w-RE-PU-ARCFIZ-2025-03-869714","RE-PU-ARCFIZ-2025-03-869714-2025-10-16T20:11:37.686Z-compiled","ADQUISICIÓN DE REACTIVOS FOSS PARA LA COORDINACIÓN GENERAL DE LABORATORIOS","2025.334.9999.0000.55.00.000.001.000.0901.530209.000000.002.0000.0000-","","7279.44","USD"
"ocds-5wno2w-RE-PU-GADPP-2025-20-2426","RE-PU-GADPP-2025-20-2426-2025-10-01T19:06:15.954Z-compiled","Servicio de Pichincha en el evento ?Dual – Pasarela en la Mitad del Mundo Fashion Show","37.36.78.744.010.2025.730249.001.17.01.50.D73.9999","","15000.00","USD"
"ocds-5wno2w-RE-PU-HEQN1-2025-003-20291","RE-PU-HEQN1-2025-003-20291-2025-10-14T20:07:00.926Z-compiled","MANTENIMIENTO PREVENTIVO Y ACTUALIZACIÓN DEL LICENCIAMIENTO A PERPETUIDAD DEL PAQUETE INFORMÁTICO DEL SISTEMA RADIOLÓGICO, ASÍ COMOLA INTEROPERABILIDAD CON EL SISTEMA HIS EN USO SISTEMA HOSVITAL PARA ELSERVICIO DE IMAGEN DEL HOSPITAL DE ESPECIAL","2025.058.0001.0000.91.00.000.001.000.1701.530704.000000.002.0000.0000-","","90000.00","USD"
"ocds-5wno2w-RE-PU-UPSE-2025-005-81550","RE-PU-UPSE-2025-005-81550-2025-10-14T20:06:59.499Z-compiled","SERVICIO DE LICENCIAS WEB OF SCIENCE CORE COLLECTION Y EMERALD MANAGEMENT CORE CON FINES DE INVESTIGACIÓN PARA LA BIBLIOTECA VIRTUAL DE LA UNIVERSIDAD ESTATAL PENÍNSULA DE SANTA ELENA","2025.187.9999.0000.83.00.000.001.000.2402.530702.000000.001.0000.0000-","","47963.63","USD"
"ocds-5wno2w-RE-PU-GADM-E-2025-003-49384","RE-PU-GADM-E-2025-003-49384-2025-10-16T20:11:36.242Z-compiled","SERVICIO DE IMPRESIONDE ESPECIES VALORADAS PARA EL GOBIERNO AUTÓNOMO DESCENTRALIZADO MUNICIPAL DE ESPEJO 2025","12.53.02.04","","3015.42","USD"
"ocds-5wno2w-RE-PU-DMG-Z8-2025-004-387997","RE-PU-DMG-Z8-2025-004-387997-2025-10-17T19:48:15.053Z-compiled","MANTENIMIENTO PREVENTIVO Y CORRECTIVO DE VEHÍCULOS MARCA CHEVROLET TIPO CAMIONETA Y AUTOMOVILES CON VIGENCIA TECNOLÓGICA","2025.052.0085.0000.01.00.000.001.000.0901.530405.000000.001.0000.0000-","","81410.73","USD"
"ocds-5wno2w-RE-PU-EMGIRS-2025-004-325307","RE-PU-EMGIRS-2025-004-325307-2025-10-17T19:48:14.310Z-compiled","SERVICIO DE ASISTENCIATÉCNICA PREVENTIVA Y CORRECTIVA PARA LA FLOTA DE 7 TRACTOCAMIONES FOTON DE LA EMGIRS-EP","63.08.03","","698643.05","USD"
"ocds-5wno2w-RE-PU-SUBZONAAZUAY-2025-002-50866","RE-PU-SUBZONAAZUAY-2025-002-50866-2025-10-02T19:07:13.135Z-compiled","SERVICIO DE MANTENIMIENTO PREVENTIVO Y CORRECTIVO DE LAS MOTOCICLETAS MARCA HONDA ENTREGADAS EN COMODATO A LASUBZONA AZUAY","2025.052.0041.0000.01.00.000.001.000.0101.530813.000000.001.0000.0000-","","18073.37","USD"
"ocds-5wno2w-RE-PU-PGADPCH-2025-01-42097","RE-PU-PGADPCH-2025-01-42097-2025-10-17T19:48:16.446Z-compiled","ADQUISICION DE DISPOSITIVOS MEDICOS PARA LABORATORIO CLINICO DE LOS EQUIPOS  HUMASTAR 100 Y HUMAREADER SINGLE PLUS DEL CENTRO DE SALUDTIPO ?B?DEL PATRONATO DEL GADPCH","2025.757.0001.0000.21.00.001.001.000.0600.730810.000000.001.0000.0000-","","4578.00","USD"
"ocds-5wno2w-RE-PU-15BAE-2025-004-54082","RE-PU-15BAE-2025-004-54082-2025-10-09T19:37:23.035Z-compiled","CONTRATACIÓN DEL SERVICIO DE MANTENIMIENTO PARA LOS VEHÍCULOS TIPO TOYOTA FORTUNER ASIGNADOS MEDIANTE ACTA DE TRASPASO POR PARTE DEL COMANDO CONJUNTO DE LAS FUERZAS ARMADAS A FAVOR DE LA FUERZA TERRESTRE GEO ECUADOR","2025.070.1050.0000.91.00.000.005.000.1705.530303.000000.001.0000.0000-","","9374.48","USD"
"ocds-5wno2w-RE-PU-CCQA-HDA-2025-004-97105","RE-PU-CCQA-HDA-2025-004-97105-2025-10-02T19:07:13.077Z-compiled","ADQUISICIÓN DE DISPOSITIVOS DE LABORATORIO PARA LOS EQUIPOS IMMULITE 1000 Y BFT II DE PROPIEDAD DE LA INSTITUCIÓN Y PARA EL EQUIPO MINDRAY BS 800, BC6200, URISEDMINI EN APOYO TECNOLÓGICO CORRESPODIENTE A LA PRIMERA ASIGNACIÓN PRESUPUESTARIA PARA EL C","530810","","292482.14","USD"
"ocds-5wno2w-RE-PU-ESPE-2025-006-30573","RE-PU-ESPE-2025-006-30573-2025-10-13T19:44:37.810Z-compiled","Provisión del servicio de acceso y uso a la base de datos científica ScienceDirect para la Universidad de las Fuerzas Armadas ESPE.","2025.189.9999.0000.83.00.000.004.000.1705.530702.000000.001.0000.0000-","","56889.00","USD"
"ocds-5wno2w-RE-PU-ULEAM-2025-003-8514","RE-PU-ULEAM-2025-003-8514-2025-10-15T20:15:47.411Z-compiled","RENOVACIÓN DEL SERVICIO DE ACCESO A UNA BASE DE DATOS ESPECIALIZADA PARA ARTÍCULOS DE ALTO IMPACTO A LA COMUNIDAD UNIVERSITARIA DE LA UNIVERSIDAD LAICA ELOY ALFARO DE MANABÍ.","2025.174.9999.0000.83.00.000.001.000.1308.530702.000000.003.0000.0000-","","27506.00","USD"
"ocds-5wno2w-RE-PU-HE-1-2025-174-43246","RE-PU-HE-1-2025-174-43246-2025-10-03T19:13:19.477Z-compiled","ADQUISICION DE REPUESTOS PARAESTERILIZADOR MARCA CISA DE LA CENTRAL DE ESTERILIZACION DEL HE1","2025.074.0000.0000.01.00.000.001.000.1701.530805.000000.002.0000.0000-","","19350.00","USD"
"ocds-5wno2w-RE-PU-HTMC-2025-009-2810","RE-PU-HTMC-2025-009-2810-2025-10-17T19:46:35.723Z-compiled","?ADQUISICIÓN DELMEDICAMENTO: ALECTINIB SOLIDO ORAL 150MG –PAC 2025, ACTA DE COMITÉ DEFARMACOTERAPIA GG-CFT-2025-001","530809","","28492.80","USD"
"ocds-5wno2w-RE-PU-GADPP-2025-18-2426","RE-PU-GADPP-2025-18-2426-2025-10-07T19:43:08.221Z-compiled","Servicio de difusión de contenido publicitario para lapromoción turística del destino Pichincha en medios convencionales y no convencionales, através de espacios publicitarios en aeropuertos, pantallas led, vallas rotativas y centroscomerciales a","37.36.78.744.008.2025.730207.001.17.01.50.D73.9999","","155500.00","USD"
"ocds-5wno2w-RE-PU-CACES-2025-002-364830","RE-PU-CACES-2025-002-364830-2025-10-15T20:15:48.575Z-compiled","CONTRATACIÓN DEL SERVICIO DE RED AVANZADA PARA EL CACES","2025.237.0000.0000.01.00.000.001.000.1701.530105.000000.003.0000.0000-","","286440.00","USD"
"ocds-5wno2w-RE-PU-HDGDZ-2025-004-62010","RE-PU-HDGDZ-2025-004-62010-2025-10-08T19:45:24.168Z-compiled","CONTRATACIÓN DEL SERVICIO DE MANTENIMIENTO PREVENTIVO Y CORRECTIVO DE LA TORRE DE ENDOSCOPIA MARCA PENTAX DEL HOSPITAL DR. GUSTAVO DOMINGUEZ Z., DE LA CIUDAD DE SANTO DOMINGO","2025.320.1428.0000.57.00.000.001.000.2301.530404.000000.002.0000.0000-","","3475.00","USD"
"ocds-5wno2w-RE-PU-IESS-CECP-2025-005-600753","RE-PU-IESS-CECP-2025-005-600753-2025-10-08T19:43:45.823Z","CONTRATACIÓN DEL SERVICIO DE MANTENIMIENTO PREVENTIVO YCORRECTIVO DEL GENERADOR ELÉCTRICO DE EMERGENCIACUMMINS, QUE INCLUYE REPUESTOS PARA EL CENTRO DEESPECIALIDADES COMITÉ DEL PUEBLO","530402","","3834.82","USD"
"ocds-5wno2w-RE-PU-CNE-2025-003-2546","RE-PU-CNE-2025-003-2546-2025-10-09T19:37:22.935Z-compiled","CONTRATACIÓN DE LA PÓLIZA DE ACTUALIZACIÓN Y SOPORTE TÉCNICO PARA EL SOFTWARE GEPR DEL CONSEJO NACIONAL ELECTORAL","2025.580.9999.0000.01.00.000.001.000.1701.530701.000000.001.0000.0000-","","8000.00","USD"
"ocds-5wno2w-RE-PU-COMEP-2025-002-1034729","RE-PU-COMEP-2025-002-1034729-2025-10-16T20:09:54.574Z-compiled","Adquisición de la licencia para la transmisión, en  territorio ecuatoriano, de la serie de televisión ?Dra.  Lucía, Temporada 1","630222","","15000.00","USD"
"ocds-5wno2w-RE-PU-UITEY-2025-009-541976","RE-PU-UITEY-2025-009-541976-2025-10-14T20:04:53.264Z-compiled","Adquisición de repuestos e instalación para un Difractómetro de Rayos X de la Escuela de Ciencias Químicas e Ingeniería de la Universidad de Investigación de Tecnología Experimental Yachay","2025.183.0000.0000.83.00.000.001.000.1006.840111.000000.003.0000.0000-","","20964.00","USD"
"ocds-5wno2w-RE-PU-EPAAGE-MEJIA-2025-07-384004","RE-PU-EPAAGE-MEJIA-2025-07-384004-2025-10-16T20:09:54.539Z-compiled","MANTENIMIENTO DEL CHASIS Y MÓDULO DELHIDROSUCCIONADOR VACTOR","6.3.04.04","","3590.78","USD"
"ocds-5wno2w-RE-PU-HE-1-2025-131-43246","RE-PU-HE-1-2025-131-43246-2025-10-09T19:38:29.648Z-compiled","ADQUISICIÓN DE SETS DEFACOEMULSIFICADOR PARA EQUIPO MARCA OPTIKON A UTILIZARSE EN LAESPECIALIDAD DE OFTALMOLOGÍA DEL HE1","2025.074.0000.0000.90.00.000.001.000.1701.530826.000000.002.0000.0000-","","26950.00","USD"
"ocds-5wno2w-RE-PU-HEJCA-2025-292-87497","RE-PU-HEJCA-2025-292-87497-2025-10-13T19:44:36.410Z-compiled","ADQUISICIÓN DE FACTOR DE COAGULACION IX, II,VII y X EN COMBINACION COMPLEJO DE PROTROMBINA HUMANA SOLIDO PARENTERAL Factor II 280 -760 UI, VII 180 - 480 UI, IX 500 UI,  X 360 - 600 UI, proteína C 260 - 620 UI y proteína S 240 - 640 UI","530809","","35092.40","USD"
"ocds-5wno2w-RE-PU-CONGOPE-2025-010-69008","RE-PU-CONGOPE-2025-010-69008-2025-10-14T20:04:53.433Z-compiled","SERVICIO DE ORGANIZACIÓN Y REALIZACIÓN DE LA XXX EDICIÓN DEL SALÓN DEL CHOCOLATE PARIS QUE SE LLEVARÁ A CABO DEL 29 DE OCTUBRE AL 2 DE NOVIEMBRE DE 2025, EN EL PARQUE DE EXPOSICIONES DE LA PORTE DE VERSAILLES, EN PARIS FRANCIA","01.02.01.003.010.001.7.73.02.49.000.99.99.99.99.17","","64962.00","USD"
"ocds-5wno2w-RE-PU-GADM-C-2025-002-55680","RE-PU-GADM-C-2025-002-55680-2025-10-15T20:15:48.654Z-compiled","ADQUISICION DE DIESELPREMIUM PARA EL PARQUE AUTOMOTOR DEL GAD MUNICIPAL DE CASCALES","7.3.02.55","","50752.99","USD"
"ocds-5wno2w-RE-PU-GADPE-2025-02-32109","RE-PU-GADPE-2025-02-32109-2025-10-16T20:09:53.772Z-compiled","SERVICIO DE MANTENIMIENTO PREVENTIVO DE LAS MAQUINARIAS DE LAS MARCAS HYUNDAI Y DAEWOO","73.04.04-73.04.05","","601013.28","USD"
"ocds-5wno2w-RE-PU-HCAM-2025-034-54651","RE-PU-HCAM-2025-034-54651-2025-10-16T20:11:39.773Z-compiled","Adquisición del dispositivo médico: Kit paracolocar anillos para Femto","530826","","44089.50","USD"
"ocds-5wno2w-RE-PU-HCAM-2025-038-54651","RE-PU-HCAM-2025-038-54651-2025-10-16T20:09:54.034Z-compiled","ADQUISICIÓN DE REPUESTOS PARA LOS MONITORES NIHON KOHDEN DEL HOSPITAL DE ESPECIALIDADES CARLOS ANDRADE MARÍN","530813","","368900.73","USD"
"ocds-5wno2w-RE-PU-ISSPOL-2025-01-3201","RE-PU-ISSPOL-2025-01-3201-2025-10-16T20:11:38.336Z-compiled","CONTRATACIÓN DEL SERVICIO DE MANTENIMIENTO PREVENTIVO DE LOS ASCENSORES MARCA MITSUBISHI INSTALADOS EN EL EDIFICIO MATRIZ ISSPOL.","5.3.04.02.001","","12893.52","USD"
"ocds-5wno2w-RE-PU-CNELEP-2025-13-462114","RE-PU-CNELEP-2025-13-462114-2025-10-13T19:39:39.641Z-compiled","GYE IMPLEMENTACIÓN DE EQUIPAMIENTO TERMOGRÁFICO EN CAMIONETAS CON DETECCIÓN AUTOMÁTICA DE ELEMENTOSELÉCTRICOS EN LAS REDES DE ALTO Y MEDIO VOLTAJE DE CNEL GYE GD","121020600000000","","2400000.00","USD"
"ocds-5wno2w-RE-PU-HEJCA-2025-322-87497","RE-PU-HEJCA-2025-322-87497-2025-10-17T19:48:18.638Z-compiled","ADQUISICIÓN DE RITUXIMAB LIQUIDO PARENTERAL 1400 MG/11,7 ML","530809","","477624.00","USD"
"ocds-5wno2w-RE-PU-HGIIIDE-TARQUI2025-006-88080","RE-PU-HGIIIDE-TARQUI2025-006-88080-2025-10-17T19:48:20.174Z-compiled","?ADQUISICIÓN DE REPUESTOS PARA EL EQUIPODE QUÍMICA SANGUÍNEA ERBA XL 300, del área de Laboratorio clínico delHOSPITAL BÁSICO H.G III DE ?TARQUI?","2025.070.1058.0000.86.00.000.003.000.0101.531404.000000.002.0000.0000-","","1739.13","USD"
"ocds-5wno2w-RE-PU-IGM-2025-008-36136","RE-PU-IGM-2025-008-36136-2025-10-17T19:48:15.757Z","CONTRATACIÓN  DEL SERVICIO DE MANTENIMIENTO DE EQUIPOS DE IMPRESIÓN DIGITAL","2025.072.0000.0000.86.00.000.003.000.1701.530704.000000.002.0000.0000-","","149850.00","USD"
"ocds-5wno2w-RE-PU-EPMAPAPED-1360067110001-2025-00001-359079","RE-PU-EPMAPAPED-1360067110001-2025-00001-359079-2025-03-26T11:44:54.612Z-compiled","ALQUILER DE LICENCIA DE USO DE SOFTWARE INFORMÁTICO ORIENTADO A LA ORGANIZACIÓN, GESTIÓN, RECAUDO Y MANEJO DE LOS SERVICIOS QUE OFRECE LA EMPRESA PÚBLICA MUNICIPAL DE AGUA POTABLE Y ALCANTARILLADO DE PEDERNALES EPMAPA-PED","6.3.07.02","","10379.52","USD"
"ocds-5wno2w-RE-PU-UEA-2025-001-124342","RE-PU-UEA-2025-001-124342-2025-03-12T12:06:57.209Z-compiled","CONTRATACIÓN DE LICENCIAS PARA EL SISTEMA DE SUPERVISIÓN DE EXAMENES EN LÍNEA PROCTORIZER","2025.185.0000.0000.82.00.000.001.000.1601.530702.000000.001.0000.0000-","","71100.00","USD"
"ocds-5wno2w-RE-PU-CBCO-2025-001-67609","RE-PU-CBCO-2025-001-67609-2025-02-13T11:34:14.989Z-compiled","MANTENIMIENTO DE LOS MÓDULOS DEL SISTEMA DEGESTIÓN EMPRESARIAL ERP OLYMPO DEL CUERPO DE BOMBEROS DEL CANTÓN OTAVALOPARA EL AÑO 2025","01.01.001.002.530701.000.10.002","","8387.50","USD"
"ocds-5wno2w-RE-PU-GADMCG-2025-001-79685","RE-PU-GADMCG-2025-001-79685-2025-03-06T11:58:14.116Z-compiled","MANTENIMIENTO PREVENTIVO Y PROGRAMADO DE DOS CAMIONETAS CHEVROLET D-MAXCRDI PREMIER PERTENECIENTES AL GOBIERNO AUTÓNOMO DESCENTRALIZADOMUNICIPAL DEL CANTÓN GUAMOTE","5.3.04.05-5.3.08.03-5.3.08.13","","9491.78","USD"
