"ocid","id","rationale","budget_id","budget_description","budget_amount","budget_currency"
"ocds-5wno2w-RE-PU-HGSQ-2025-001-868544","RE-PU-HGSQ-2025-001-868544-2025-08-12T22:25:37.506Z-compiled","ADQUISICIÓN DE CIRCUITO UNIVERSAL PARAVENTILADOR DE TRANSPORTE PEDIÁTRICO PARA EL HOSPITAL GENERAL DEL SURDE QUITO","530826","","12800.00","USD"
"ocds-5wno2w-RE-PU-HCAM-2025-005-54651","RE-PU-HCAM-2025-005-54651-2025-04-25T12:47:08.007Z-compiled","Adquisición del medicamento PERTUZUMAB LIQUIDO PARENTERAL S.I. 30 MG/ML para laUnidad Técnica de Farmacia Hospitalaria","530809","","399000.00","USD"
"ocds-5wno2w-RE-PU-BASEDU-2025-002-42111","RE-PU-BASEDU-2025-002-42111-2025-04-02T12:01:26.486Z-compiled","SERVICIO DE MANTENIMIENTO PREVENTIVO Y CORRECTIVO PARALOS VEHÍCULOS CHEVROLET D-MAX CRDI PREMIER AC 2.5 CD 4X4 TMDIESEL DE LA BASE NAVAL SAN EDUARDO","2025.070.3017.0000.55.00.000.001.000.0901.530405.000000.001.0000.0000-","","33080.19","USD"
"ocds-5wno2w-RE-PU-CCQA-HD-CHIMBACALLE-2025-01-80443","RE-PU-CCQA-HD-CHIMBACALLE-2025-01-80443-2025-04-09T12:54:42.889Z-compiled","Adquisición placas de procesamiento en seco de tamaño 10x12"" y 14x17 para impresora AGFA para el servicio de Imagenología del C.C.Q.A. H.D Chimbacalle","32","","19776.00","USD"
"ocds-5wno2w-RE-PU-AGUAPAS-2025-002-585093","RE-PU-AGUAPAS-2025-002-585093-2025-04-22T12:18:05.595Z-compiled","SERVICIO DE MANTENIMIENTO POSTVENTA PARA VEHÍCULO LIVIANO TIPOCAMIONETA DE COMERCIALIZACIÓN","5.3.04.05","","10260.73","USD"
"ocds-5wno2w-RE-PU-HGSQ-2025-002-868544","RE-PU-HGSQ-2025-002-868544-2025-04-22T12:18:05.899Z-compiled","ADQUISICIÓN DE DISPOSITIVOS DE HEMODIÁLISIS PARA LAS MÁQUINAS MARCA FRESENIUS MODELO 4008S PROPIEDAD DEL HOSPITAL GENERAL DEL SUR DE QUITO","530826","","393362.16","USD"
"ocds-5wno2w-RE-PU-MINTEL-2025-001-236348","RE-PU-MINTEL-2025-001-236348-2025-04-24T12:46:24.017Z-compiled","MANTENIMIENTO DE ASCENSORES DEL EDIFICIO PARTENÓN","2025.540.0000.0000.01.00.000.001.000.1701.530402.000000.001.0000.0000-","","7473.36","USD"
"ocds-5wno2w-RE-PU-GADG-2025-001-2620","RE-PU-GADG-2025-001-2620-2025-05-01T12:36:03.671Z-compiled","ADQUISICIÓN DE REPUESTOS, ACCESORIOS Y SERVICIO DE MANTENIMIENTO PREVENTIVO DE: MOTONIVELADORA, RODILLO VIBRATORIO EXCAVADORA RETROEXCAVADORA MINICARGADORA DE PROPIEDAD DEL GAD-GONZANAMÁ","3.6.1.7.3.04.04-3.6.1.7.3.08.13-3.6.1.7.3.08.03","","42361.34","USD"
"ocds-5wno2w-RE-PU-GADMCO-2025-001-26427","RE-PU-GADMCO-2025-001-26427-2025-04-12T13:19:21.708Z-compiled","Contratación del servicio de mantenimiento preventivo de las camionetas marca Great Wall modelo Poer año 2024","03.A100.110.02.730803.000.10.A13.01.99.99.99.99.00","","9776.00","USD"
"ocds-5wno2w-RE-PU-HGONA-2025-001-730708","RE-PU-HGONA-2025-001-730708-2025-09-24T18:50:13.815Z-compiled","ADQUISICIÓN DE AGENTE ESTERILIZANTE PERÓXIDO DE HIDRÓGENO PARA EL HOSPITAL GINECO OBSTÉTRICO PEDIÁTRICO DE NUEVA AURORA LUZ ELENA  ARISMENDI","2025.320.9002.0000.90.00.000.005.000.1701.530826.000000.001.0000.0000-","","74200.00","USD"
"ocds-5wno2w-RE-PU-DHG-2025-003-5702","RE-PU-DHG-2025-003-5702-2025-06-25T16:26:05.434Z-compiled","CONTRATACIÓN DEL SERVICIO DE MANTENIMIENTO PREVENTIVO Y CORRECTIVO ANUAL DEL EQUIPO LÁSER DE HOLMIO DE 100 WATTSS MARCA LUMENIS MODELO VERSAPULSE POWERSUITE DEL SERVICIO DE UROLOGÍA DE LA DHG","2025.058.0002.0000.91.00.000.001.000.0901.530404.000000.001.0000.0000-","","13500.00","USD"
"ocds-5wno2w-RE-PU-FONAG-2025-004-227909","RE-PU-FONAG-2025-004-227909-2025-04-10T12:38:30.301Z-compiled","CONTRATACIÓN DEL SERVICIO DE UN LABORATORIO CERTIFICADO PARA EL ANÁLISIS DE MUESTRAS DE AGUA DE LA RED DE MONITOREO PERMANENTE FONAG REQUERIDOS PARA LA COMPARACIÓN HISTÓRICA CON ANÁLISIS ANTERIORES","ACTPGA2025003T003-ACTACH2025015T","","10557.00","USD"
"ocds-5wno2w-RE-PU-EPMMOP-2025-06-741823","RE-PU-EPMMOP-2025-06-741823-2025-05-13T12:39:55.341Z-compiled","PRESTACIÓN DEL SERVICIO DE SOPORTE AL SISTEMA CGWEB INSTALADO EN LA EPMMOP","530701","","22059.00","USD"
"ocds-5wno2w-RE-PU-UTM-2025-001-41046","RE-PU-UTM-2025-001-41046-2025-04-16T12:40:45.958Z-compiled","CONTRATACIÓN SERVICIO DE ACCESO A LA RED AVANZADA DEINVESTIGACIÓN Y ACADEMIA PARA LA UNIVERSIDAD TÉCNICA DE MANABÍ","2025.173.0000.0000.01.00.000.001.000.1301.530303.000000.001.0000.0000-","","266736.36","USD"
"ocds-5wno2w-RE-PU-HEJCA-2025-041-87497","RE-PU-HEJCA-2025-041-87497-2025-04-16T12:40:46.375Z-compiled","ADQUISICIÓN DE OCRELIZUMAB LIQUIDO PARENTERAL 30 MG/ML","530809","","237338.10","USD"
"ocds-5wno2w-RE-PU-FMS-2025-001-283676","RE-PU-FMS-2025-001-283676-2025-04-01T11:58:26.425Z-compiled","RENOVACIÓN DEL CONTRATO PARA LA PRESTACIÓN DEL SERVICIO PARA SOPORTE, MANTENIMIENTO Y ACTUALIZACIÓN DE LOS SISTEMAS FINANCIERO, ADMINISTRATIVO Y PUNTO DE VENTA CODISA NAF Y CODISA RETAIL DE LA EMPRESA FARMASOL EP.","5.3.07.01","","15350.00","USD"
"ocds-5wno2w-RE-PU-HCAM-2025-006-54651","RE-PU-HCAM-2025-006-54651-2025-04-29T12:22:02.336Z-compiled","Adquisición del medicamento GUSELKUMABLIQUIDO PARENTERAL S.I. 100 MG/ML para la Unidad Técnica de Farmacia Hospitalaria","530809","","265735.50","USD"
"ocds-5wno2w-RE-PU-EPMSA-2025-02-259318","RE-PU-EPMSA-2025-02-259318-2025-06-09T15:47:21.828Z-compiled","Adquirir suministros para los equipos detectores de trazas de explosivos","630804","","11842.00","USD"
"ocds-5wno2w-RE-PU-GADPP-2025-1-2426","RE-PU-GADPP-2025-1-2426-2025-07-02T17:36:22.499Z-compiled","SERVICIO DE POSICIONAMIENTO DEL DESTINO PICHINCHA EN EL EVENTO?COPA MUNDIAL DE FOTOGRAFÍA 2025? EL 20 Y 21 DE MARZO DE 2025 EN LAPROVINCIA DE PICHINCHA","37.36.78.744.007.2025.7302025","","15000.00","USD"
"ocds-5wno2w-RE-PU-ISSFA-2025-001-2803","RE-PU-ISSFA-2025-001-2803-2025-05-06T12:30:41.212Z-compiled","?SERVICIO DE MANTENIMIENTO DE LOS ASCENSORES DEL EDIFICIO ISSFA MATRIZ?","2025.3.304.0001.5.3.0404","","9843.48","USD"
"ocds-5wno2w-RE-PU-GADPDM-2025-001-2609","RE-PU-GADPDM-2025-001-2609-2025-04-12T13:20:17.839Z-compiled","SERVICIO DE INFRAESTRUCTURA DE CLOUD SERVICIO EN LA NUBE PARA EL GOBIERNO AUTONOMO DESCENTRALIZADO DE LA PROVINCIAL DE MANABÍ","53.01.05","","204231.36","USD"
"ocds-5wno2w-RE-PU-EPMMOP-2025-07-741823","RE-PU-EPMMOP-2025-07-741823-2025-07-08T17:45:50.778Z-compiled","ADQUISICIÓN DE REPUESTOS Y ACCESORIOS INCLUIDO SERVICIO DE INSTALACIÓN PARA MAQUINARIA DE LA MARCA CASE","6.3.08.13","","17653.64","USD"
"ocds-5wno2w-RE-PU-HEP-2025-00003-889479","RE-PU-HEP-2025-00003-889479-2025-09-30T18:59:22.371Z-compiled","ADQUISICIÓN DEL MEDICAMENTO FUERA DEL CUADRO NACIONAL DE MEDICAMENTOS BASICOS RIBOCICLIB SÓLIDO ORAL 200 MG PARA CÁNCER DE MAMA HR+, HER2- AVANZADO PARA PACIENTE DEL HOSPITAL DE ESPECIALIDADES PORTOVIEJO","2025.320.9004.0000.58.00.000.002.000.1301.530809.000000.001.0000.0000-","","17830.26","USD"
"ocds-5wno2w-RE-PU-MDMQ-2025-8002-41357","RE-PU-MDMQ-2025-8002-41357-2025-03-22T12:40:42.088Z-compiled","El objeto del presente es la contratacion del SERVICIO DE MANTENIMIENTO PREVENTIVO YCORRECTIVO DE LOS VEHICULOS LIVIANOS CON VIGENCIA TECNOLOGICA DE LA ADMINISTRACIONZONAL LOS CHILLOS AZLC","530243","","15312.00","USD"
"ocds-5wno2w-RE-PU-EPA-2025-001-555086","RE-PU-EPA-2025-001-555086-2025-04-25T12:47:10.254Z-compiled","SERVICIO DE MANTENIMIENTO PREVENTIVO Y CORRECTIVO PARA EL CUMPLIMIENTO DE LA VIGENCIA TECNOLÓGICA DE TRACTORES DE ORUGA Y TRACTO CAMIONES MÁS CAMA BAJA DE LA EPA EP","630404","","83253.34","USD"
"ocds-5wno2w-RE-PU-HCAM-2025-007-54651","RE-PU-HCAM-2025-007-54651-2025-04-25T12:47:10.136Z-compiled","Adquisición del dispositivo médico: KIT DE CIRUGÍA CARDÍACA PREMONTADA CON OXIGENADOR RECUBIERTO, DE MEMBRANA, ADULTO, CON MEMBRANA DE INTERCAMBIADOR DE CALOR INTEGRADO para la Unidad de Cardiotorácica","530826","","357000.00","USD"
"ocds-5wno2w-RE-PU-HCAM-2025-003-54651","RE-PU-HCAM-2025-003-54651-2025-05-01T12:36:05.885Z-compiled","DQUISICIÓN DEL DISPOSITIVO MÉDICO:SISTEMA INMUNOHISTOQUÍMICA PARA LA UNIDAD TÉCNICA DE ANATOMÍA PATOLÓGICA","530810","","556074.11","USD"
"ocds-5wno2w-RE-PU-GADMAA-2025-001-50459","RE-PU-GADMAA-2025-001-50459-2025-06-27T16:23:33.976Z-compiled","MANTENIMIENTO PREVENTIVO Y CORRECTIVO DE LAS CAMIONETAS GRET WALL DEL GAD MUNICIPAL DE ANTONIO ANTE","140.7.3.04.05140.7.3.08.13","","31238.36","USD"
"ocds-5wno2w-RE-PU-BASESM-2025-001-85929","RE-PU-BASESM-2025-001-85929-2025-03-22T12:40:18.458Z-compiled","Servicio de mantenimiento preventivo y correctivo de los vehículos que mantienen vigencia tecnológica, asignados a la Base Naval Esmeraldas, incluyen repuestos y lubricantes","2025.070.3045.0000.01.00.000.001.000.0801.530104.000000.001.0000.0000-","","41060.12","USD"
"ocds-5wno2w-RE-PU-GADMEP-2025-03-36452","RE-PU-GADMEP-2025-03-36452-2025-06-11T15:48:53.498Z-compiled","CONTRATACIÓN DEL SERVICIO DE UN TALLER EXTERNO PARA MANTENIMIENTO PREVENTIVO Y CORRECTIVO INCLUIDO REPUESTOS ORIGINALES PARA LA CAMIONETA TOYOTA HILUX ZMA-1067","7.3.04.05","","9230.90","USD"
"ocds-5wno2w-RE-PU-DIRNEA-2025-001-585577","RE-PU-DIRNEA-2025-001-585577-2025-04-25T12:47:11.057Z-compiled","CONTRATACIÓN DE MANTENIMIENTO PREVENTIVO PARA DOS 2 VEHICULOS TIPO CAMIONETA MARCA GREAT WALL MODELO POER DC 4X2, DE PROPIEDAD DE LA DIRECCIÓN NACIONAL DE LOS ESPACIOS ACUATICOS DIRNEA","2025.070.3059.0000.91.00.000.004.000.0901.530405.000000.001.0000.0000-","","3677.95","USD"
"ocds-5wno2w-RE-PU-HGSQ-2025-003-868544","RE-PU-HGSQ-2025-003-868544-2025-04-29T12:22:03.877Z-compiled","ADQUISICIÓN DE CAL SODADA 1.2 LITROS PARA EL HOSPITAL GENERAL DEL SUR DE QUITO","02.00.000.002.530826.1701.601.0000.0000","","22010.00","USD"
"ocds-5wno2w-RE-PU-EPCH-2025-0002-329706","RE-PU-EPCH-2025-0002-329706-2025-05-08T12:36:09.245Z-compiled","CONTRATACION DEL SERVICIO DE MANTENIMIENTO PREVENTIVO Y CORRECTIVO REPUESTOS Y ACCESORIOS POR PERIODO DE VIGENCIA TECNOLOGICA Y GARANTIA TECNICA DE LA CAMIONETA CHEVROLET D MAX CDRI PREMIER AC 2 5 CD 4x4 PERTENECIENTES A LA EMPRESA PUBLICA DEL COMPLE","730405","","4456.66","USD"
"ocds-5wno2w-RE-PU-COGUAR-2025-00002-25964","RE-PU-COGUAR-2025-00002-25964-2025-06-25T16:26:09.707Z-compiled","MANTENIMIENTO PREVENTIVO DE LOS VEHICULOS GREAT WALL DEL COMANDO DE GUARDACOSTAS","2025.070.3011.0000.91.00.000.003.000.0901.530802.000000.001.0000.0000-","","7121.52","USD"
"ocds-5wno2w-RE-PU-SPE-2025-00002-1045225","RE-PU-SPE-2025-00002-1045225-2025-04-09T12:54:43.693Z-compiled","Contratación para el servicio de manipulación de carga en el terminal de Carga de Quito TCC","630202","","99268.13","USD"
"ocds-5wno2w-RE-PU-UIAD-2025-001-270725","RE-PU-UIAD-2025-001-270725-2025-04-30T12:29:38.928Z-compiled","CONTRATACIÓN DEL SERVICIO DE UNA MECÁNICA AUTOMOTRIZ PARA EL MANTENIMIENTO PREVENTIVO Y CORRECTIVO DE LOS VEHÍCULOS DE LA MARCA GREAT WALL, MODELO WINGLE 7 AC 2.0 CD 4X4 TM DIÉSEL, ASIGNADOS A LA SOIA-PICHINCHA","2025.052.0084.0000.01.00.000.001.000.1701.530405.000000.001.0000.0000-","","7212.60","USD"
"ocds-5wno2w-RE-PU-MDMQ-2025-1510-41357","RE-PU-MDMQ-2025-1510-41357-2025-06-04T15:44:09.656Z-compiled","MANTENIMIENTO DE ASCENSOR DEPROPIEDAD DEL IMP AÑO 2025","530404","","2374.20","USD"
"ocds-5wno2w-RE-PU-CELECEP-2025-06027-238940","RE-PU-CELECEP-2025-06027-238940-2025-06-04T15:44:10.471Z-compiled","HNA ADQUISICION DE SELLO DE ESTANQUEIDAD PARA LA VÁLVULA MARIPOSA DE LA TURBINA DE LA CHMLDW","5110200304","","61235.00","USD"
"ocds-5wno2w-RE-PU-HVCM-2025-002-12070","RE-PU-HVCM-2025-002-12070-2025-06-11T15:47:36.453Z-compiled","ADQUISICIÓN DE TUBO COLIMADOR PARA EL EQUIPO DE TOMOGRAFÍA, CON INSTALACIÓN","2025.320.1000.0000.90.00.000.004.000.0101.530204.000000.001.0000.0000-","","24890.00","USD"
"ocds-5wno2w-RE-PU-HOSNAG-2025-001-2706","RE-PU-HOSNAG-2025-001-2706-2025-04-10T12:37:45.663Z-compiled","?ADQUISICIÓN DE 300 UNIDADES DEL MEDICAMENTO LORLATINIB 100 MG SOLIDO QUE NO CONSTA EN EL CUADRO NACIONAL DE MEDICAMENTOS BASICOS VIGENTES?","2025.070.3030.0000.86.00.000.003.000.0901.530809.000000.002.0000.0000-","","38493.00","USD"
"ocds-5wno2w-RE-PU-HCAM-2025-001-54651","RE-PU-HCAM-2025-001-54651-2025-04-23T12:29:23.584Z-compiled","MANTENIMIENTOPREVENTIVO Y CORRECTIVO PARA LAS CAMAS HOSPITALARIAS, SILLONES ONCOLÓGICOS YSILLONES DE HEMODIÁLISIS MARCA FERROMEDICA PERTENECIENTES AL HOSPITAL DEESPECIALIDADES CARLOS ANDRADE MARI","530813-530404","","245072.82","USD"
"ocds-5wno2w-RE-PU-HEEE-2025-003-52558","RE-PU-HEEE-2025-003-52558-2025-04-16T12:40:43.032Z-compiled","ADQUISICION DEL MEDICAMENTOOSIMERTINIB SÓLIDO ORAL 80 MG PARA PACIENTE AUTORIZADO PARA EL HOSPITAL DEESPECIALIDADES EUGENIO ESPEJO","2025.320.1420.0000.58.00.000.002.000.1701.530809.000000.001.0000.0000-","","117000.00","USD"
"ocds-5wno2w-RE-PU-CCFFAA-2025-001-2539","RE-PU-CCFFAA-2025-001-2539-2025-04-30T12:29:36.657Z-compiled","Mantenimiento preventivo y correctivo del sistema especial ascensores del edificio Comando Conjunto de las Fuerzas Armadas, para mantener el correcto funcionamiento y garantizar la integridad de todo el personal, correspondiente al año 2025","2025.070.4999.0000.91.00.000.009.000.1701.530404.000000.002.0000.0000-","","6999.93","USD"
"ocds-5wno2w-RE-PU-EPMTTM-2025-01-393608","RE-PU-EPMTTM-2025-01-393608-2025-06-03T15:38:55.863Z-compiled","SERVICIO DE MANTENIMIENTO PREVENTIVO Y CORRECTIVO DE LA ESTRUCTURA EXTERIOR DE LOS EQUIPOS DEL SISTEMA DE AUTOMATIZACIÓN Y HORAS DE DESARROLLO PARA SU SOFTWARE DE CONTROL DEL TERMINAL TERRESTRE DE MACHALA EP","530402","","15810.00","USD"
"ocds-5wno2w-RE-PU-HEJCA-2025-006-87497","RE-PU-HEJCA-2025-006-87497-2025-04-23T12:29:24.258Z-compiled","ADQUISICIÓN DE INMUNOGLOBULINA HUMANA NORMAL LÍQUIDO PARENTERAL 100MG/ML","530809","","187207.20","USD"
"ocds-5wno2w-RE-PU-HDGDZ-2025-003-62010","RE-PU-HDGDZ-2025-003-62010-2025-08-12T22:25:38.396Z-compiled","CONTRATACIÓN DEL SERVICIO DE MANTENIMIENTO CORRECTIVO PARA AMBULANCIA IVECO DEL HOSPITAL DR. GUSTAVO DOMINGUEZ Z., DE LA CIUDAD DE SANTO DOMINGO","2025.320.1428.0000.90.00.000.003.000.2301.530405.000000.001.0000.0000-","","1188.66","USD"
"ocds-5wno2w-RE-PU-SENAEDDG-2025-01-124235","RE-PU-SENAEDDG-2025-01-124235-2025-05-07T12:36:38.951Z-compiled","SERVICIO DE MANTENIMIENTO PREVENTIVO, CORRECTIVO Y SOPORTE TÉCNICO PARA LOS EQUIPOS DE RAYOS X DE MARCA SMITHS HEIMANN DEPROPIEDAD DEL SENAE","2025.136.0003.0000.01.00.000.001.000.0901.530402.000000.001.0000.0000-","","14870.30","USD"
"ocds-5wno2w-RE-PU-DNPJ-2025-001-183304","RE-PU-DNPJ-2025-001-183304-2025-04-30T12:29:38.528Z-compiled","Servicio de enlace de datos con la Empresa S.A.CONECEL-CLARO para el DORT","2025.057.0000.0000.01.00.000.001.000.1701.530105.000000.001.0000.0000-","","3690.00","USD"
"ocds-5wno2w-RE-PU-CDBC-2025-001-70988","RE-PU-CDBC-2025-001-70988-2025-05-01T12:36:04.466Z-compiled","SERVICIO PARA REALIZAR LOS MANTENIMIENTOS PREVENTIVOS Y CORRECTIVOS POR VIGENCIA TECNOLÓGICA A LAS CAMIONETAS NUEVAS","53.04.05","","9829.64","USD"
"ocds-5wno2w-RE-PU-ESNAQI-2025-001-2554","RE-PU-ESNAQI-2025-001-2554-2025-04-29T12:22:05.016Z-compiled","MANTENIMIENTO PREVENTIVO DE CAMIONETAS DOBLE CABINA4X2 A DIÉSEL","2025.070.3028.0000.01.00.000.001.000.1701.530505.000000.001.0000.0000-","","16301.81","USD"
"ocds-5wno2w-RE-PU-GADC-2025-18875-2616","RE-PU-GADC-2025-18875-2616-2025-04-29T12:22:04.893Z-compiled","MANTENIMIENTO PREVENTIVO Y CORRECTIVO DE LOS 13 ASCENSORES MITSUBISHI INSTALADO EN LAS DIFERENTES DEPENDENCIAS DEL GAD MUNICIPAL DEL CANTÓN CUENCA","5.1.14.3.04.04","","50235.48","USD"
"ocds-5wno2w-RE-PU-HSLO-2025-01-2580","RE-PU-HSLO-2025-01-2580-2025-05-09T12:33:30.018Z-compiled","ADQUISICIÓN DE REPUESTOS Y CONTRATACIÓN DEL SERVICIO DE MANTENIMIENTO DE CAMAS HOSPITALARIAS TIPO II HOPEFULL BA868Y DEL HOSPITAL SAN LUIS DE OTAVALO","2025.320.1256.0000.90.00.000.004.000.1004.530101.000000.001.0000.0000-","","13690.00","USD"
"ocds-5wno2w-RE-PU-CNE-2025-001-2546","RE-PU-CNE-2025-001-2546-2025-04-11T12:58:45.202Z-compiled","CONTRATAR EL SERVICIO DE GARANTÍA EXTENDIDA Y SOPORTE TÉCNICO DE AIRES ACONDICIONADOS PRECISION COOLING Y UPS COMPUTER POWER DEL CONSEJO NACIONAL ELECTORAL","2025.580.9999.0000.01.00.000.001.000.1701.530404.000000.001.0000.0000-","","24975.00","USD"
"ocds-5wno2w-RE-PU-GADPP-2025-4-2426","RE-PU-GADPP-2025-4-2426-2025-05-09T12:32:30.834Z-compiled","SERVICIO DE PARTICIPACIÓN DEL GAD DE LA PROVINCIA DE PICHINCHA EN EL EVENTO EXPOSICIÓN DE EMPRENDIMIENTOS POR EL PREGÓN DE LAS FIESTAS DE PACTO","06.36.42.734.001.2025.730205.002.17.01.72.D21.9999","","13500.00","USD"
"ocds-5wno2w-RE-PU-UEA-2025-002-124342","RE-PU-UEA-2025-002-124342-2025-06-06T15:45:43.630Z-compiled","CONTRATACIÓN DE ACCESO Y USO A LA HERRAMIENTA WOLFRAM PARA LA UNIVERSIDAD ESTATAL AMAZÓNICA","2025.185.0000.0000.01.00.000.001.000.1601.530702.000000.001.0000.0000-","","10500.00","USD"
"ocds-5wno2w-RE-PU-GADMSR-2025-001-38391","RE-PU-GADMSR-2025-001-38391-2025-04-16T12:41:40.559Z-compiled","QUINTA ETAPA DE DIGITACIÓN DE LA INFORMACIÓN REGISTRAL DEL ARCHIVO FÍSICO,TRANSCRIBIÉNDOLA EN REGISTROS ELECTRÓNICOS EN EL REGISTRO DE LA PROPIEDADMUNICIPAL DEL CANTON SANTA ROSA","111.53.02.30","","54540.00","USD"
"ocds-5wno2w-RE-PU-CEN-2025-001-715112","RE-PU-CEN-2025-001-715112-2025-05-01T12:36:07.866Z-compiled","COMPLEMENTAR MÓDULOS PARA LA LICENCIA DEPOWERFACTORY DE DIGSILENT","2025.095.9999.0000.55.00.000.001.000.1701.530702.000000.002.0000.0000-","","39085.00","USD"
"ocds-5wno2w-RE-PU-HGSQ-2025-005-868544","RE-PU-HGSQ-2025-005-868544-2025-05-31T15:38:44.507Z-compiled","CONTRATACIÓN DEL SERVICIO DEMANTENIMIENTO PREVENTIVO Y CORRECTIVO PARA LOS EQUIPOS DELA MARCA ERBE DEL HOSPITAL GENERAL DEL SUR DE QUITO","530404","","213056.89","USD"
"ocds-5wno2w-RE-PU-SRI-2025-80001-2438","RE-PU-SRI-2025-80001-2438-2025-06-03T15:38:57.742Z-compiled","DZ8 REPARACIÓN DE ASCENSORES DEL EDIFICIO SRI WTC","2025.135.0000.0000.01.00.000.002.000.0901.530402.000000.001.0000.0000-","","29569.57","USD"
"ocds-5wno2w-RE-PU-HOSNAG-2025-002-2706","RE-PU-HOSNAG-2025-002-2706-2025-04-23T12:29:29.491Z-compiled","?ADQUISICIÓN DE CÁPSULAS ENDOSCOPICAS PARA EL AREA DE ENDOSCOPIA DIGESTIVA HOSNAG 2025?","2025.070.3030.0000.86.00.000.003.000.0901.530826.000000.002.0000.0000-","","7391.30","USD"
"ocds-5wno2w-RE-PU-HEJCA-2025-046-87497","RE-PU-HEJCA-2025-046-87497-2025-04-26T13:04:37.438Z-compiled","ADQUISICIÓN DE RITUXIMAB LIQUIDO PARENTERAL 10 MG/ML VIAL X 50 ML","530809","","22207.40","USD"
"ocds-5wno2w-RE-PU-GADPR-TURI-2025-001-93749","RE-PU-GADPR-TURI-2025-001-93749-2025-05-01T12:36:08.723Z-compiled","ADQUISICION E INSTALACION DE TRANSMISION Y COMPONENTES PARA LA REPARACION DE MAQUINARIA TIPO RETROEXCAVADORA JOHN DEERE DE PROPIEDAD DEL GAD PARROQUIAL DE TURI","730813","","47185.52","USD"
"ocds-5wno2w-RE-PU-GADC-2025-24082-2616","RE-PU-GADC-2025-24082-2616-2025-05-14T12:48:17.332Z-compiled","?ADQUISICIÓN DE REACTIVOS PARA LABORATORIO CLÍNICO DE LA UNIDAD DE SEGURIDAD Y SALUD DEL TRABAJO DEL GAD MUNICIPAL DEL CANTÓN CUENCA?","5.1.11.3.08.10","","18845.80","USD"
"ocds-5wno2w-RE-PU-EPMMOP-2025-09-741823","RE-PU-EPMMOP-2025-09-741823-2025-08-22T18:38:04.960Z-compiled","ADQUISICIÓN DE REPUESTOS Y ACCESORIOS INCLUIDO SERVICIO DE INSTALACIÓN PARA MAQUINARIA DE LA MARCA JOHN DEERE","630813","","150000.00","USD"
"ocds-5wno2w-RE-PU-ARCONEL2025-007-1215959","RE-PU-ARCONEL2025-007-1215959-2025-05-01T12:36:08.447Z-compiled","MANTENIMIENTO PREVENTIVO, CORRECTIVO Y ADQUISICIÓN DE REPUESTOS Y ACCESORIOS PARA EL UPS 80KVA","2025.018.9999.0000.01.00.000.001.000.1701.840103.000000.002.0000.0000-","","19369.85","USD"
"ocds-5wno2w-RE-PU-EPMMM-2025-002-585764","RE-PU-EPMMM-2025-002-585764-2025-05-07T12:36:36.329Z-compiled","MANTENIMIENTO PREVENTIVO Y CORRECTIVO DE LAS MOTOCICLETAS DEL ÁREA DE CONTROL Y VIGILANCIA, DE LA EMPRESA PÚBLICA MUNICIPAL DE MOVILIDAD DE MACHALA, EN TALLER AUTORIZADO","53.04.05,53.08.13,53.08.03","","121564.20","USD"
"ocds-5wno2w-RE-PU-SRI-2025-80002-2438","RE-PU-SRI-2025-80002-2438-2025-05-30T15:30:28.250Z-compiled","DZ8 ADQUISICIÓN DE ROLLOS DE TURNOS PARA EQUIPOS QMATIC","2025.135.0000.0000.01.00.000.002.000.0901.530804.000000.001.0000.0000-","","230.00","USD"
"ocds-5wno2w-RE-PU-HCAM-2025-002-54651","RE-PU-HCAM-2025-002-54651-2025-05-01T12:36:05.730Z-compiled","ADQUISICIÓN DE LOS MEDICAMENTOS GRUPO AGENTES ANTINEOPLÁSICOS E INMUNOMODULADORES NRO 1 RUXOLITINIB SÓLIDO ORAL PARA LA UNIDAD TÉCNICA DE FARMACIA HOSPITALARIA","530809","","599421.60","USD"
"ocds-5wno2w-RE-PU-ISSFA-2025-02-2803","RE-PU-ISSFA-2025-02-2803-2025-05-20T15:12:39.137Z-compiled","TOCILIZUMAB LÍQUIDO PARENTERAL 162 MG SOBRE 0.9 ML","2025.3.304.0001.5.2.0103.3","","91390.00","USD"
"ocds-5wno2w-RE-PU-HEP-2025-00004-889479","RE-PU-HEP-2025-00004-889479-2025-06-18T16:59:07.175Z-compiled","ADQUISICIÓN DEL MEDICAMENTO TRETINOINAACIDO TRANSRETINOICO- ATRA SOLIDO ORAL 10MG, PARA CUBRIRCON EL TRATAMIENTO A LOS PACIENTES CON LEUCEMIAPROMIELOCITICA AGUDA LPA ATENDIDOS EN EL HOSPITALDE ESPECIALIDADES PORTOVIEJO","2025.320.9004.0000.58.00.000.005.000.1301.530809.000000.003.0000.0000-","","9765.00","USD"
"ocds-5wno2w-RE-PU-EPAAGE-MEJIA-2025-02-384004","RE-PU-EPAAGE-MEJIA-2025-02-384004-2025-04-04T12:52:45.221Z-compiled","MANTENIMIENTO DE CAMIONETAS A DIESEL DE LA EPAAGE-MEJIA, EP","6.3.04.05","","5000.00","USD"
"ocds-5wno2w-RE-PU-DNPJ-2025-002-183304","RE-PU-DNPJ-2025-002-183304-2025-04-22T12:19:07.727Z-compiled","Adquisición de reactivos de quimio-luminiscencia para análisis del lugar de los hechos, para laDirección Nacional de Investigación Técnico Científica Policial a nivel nacional.","2025.057.0000.0000.91.00.000.001.000.0100.530829.000000.001.0000.0000-","","14945.30","USD"
"ocds-5wno2w-RE-PU-MDMQ-2025-501-41357","RE-PU-MDMQ-2025-501-41357-2025-07-01T17:37:49.562Z-compiled","CONTRATACIÓN DE LOS SERVICIOS DE MECÁNICA AUTOMOTRIZ PARA MANTENIMIENTO PREVENTIVO Y CORRECTIVO DE LOS VEHÍCULOS DE LA AZLD VIGENCIA TECNOLÓGICA","530813","","41405.54","USD"
"ocds-5wno2w-RE-PU-CCQA-HDA-2025-001-97105","RE-PU-CCQA-HDA-2025-001-97105-2025-04-12T13:22:03.914Z-compiled","ADQUISICIÓN DE DISPOSITIVOS DE LABORATORIO PARA LOS EQUIPOS IMMULITE 1000 Y BFT II DE PROPIEDAD DE LA INSTITUCIÓN Y PARA EL EQUIPO MINDRAY BS 800, BC6200, URISEDMINI EN APOYO TECNOLÓGICO CORRESPODIENTE A LA PRIMERA ASIGNACIÓN PRESUPUESTARIA PARA EL C","530810","","153353.43","USD"
"ocds-5wno2w-RE-PU-CELECEP-2025-02183-238940","RE-PU-CELECEP-2025-02183-238940-2025-05-29T15:31:20.649Z-compiled","EGU SERVICIO DE INSTALACIÓN DE BOMBA DE AGUA DE ALIMENTO DE UNIDAD TV1 CENTRAL ANÍBAL SANTOS","5110200907","","296590.00","USD"
"ocds-5wno2w-RE-PU-CCQA-HDA-2025-002-97105","RE-PU-CCQA-HDA-2025-002-97105-2025-04-25T12:47:13.947Z-compiled","ADQUISICIÓN DE PLACAS RADIOGRÁFICAS, PARA EL CENTRO CLÍNICO QUIRÚRGICO HOSPITAL DEL DÍA AZOGUES.","530833","","8470.00","USD"
"ocds-5wno2w-RE-PU-SZC3-2025-001-180186","RE-PU-SZC3-2025-001-180186-2025-05-02T12:29:16.704Z-compiled","SERVICIO DE MANTENIMIENTO PREVENTIVO Y CORRECTIVO PARA LOS VEHÍCULOS TIPO CAMIONETA MARCA CHEVROLET POR VIGENCIA TECNOLOGICA DE LA SUBZONA DE POLICIA CAÑAR","2025.052.0042.0000.01.00.000.001.000.0301.530405.000000.001.0000.0000-","","10059.51","USD"
"ocds-5wno2w-RE-PU-IESS-2025-00003-39594","RE-PU-IESS-2025-00003-39594-2025-05-16T12:48:52.503Z-compiled","Realizar un procedimiento de contratación para el servicio de MANTENIMIENTO DE ASCENSORES DIRECCION PROVINCIAL AZUAY DPA lo cual permitirá garantizar el funcionamiento y conservar en condiciones óptimas el sistema de transportación vertical que es","53040102","","15229.08","USD"
"ocds-5wno2w-RE-PU-MTS-EP-2025-001-779303","RE-PU-MTS-EP-2025-001-779303-2025-05-16T12:48:49.398Z-compiled","MANTENIMIENTO PREVENTIVO, CORRECTIVO, VERIFICACIÓN, AJUSTE Y CALIBRACIÓN DELOS EQUIPOS DE LOS CENTROS DE REVISIÓN TÉCNICA VEHICULAR","7.3.04.04","","70410.04","USD"
"ocds-5wno2w-002-67972","002-67972-2025-06-18T16:56:56.170Z-compiled","ADQUISICIÓN DE NC. DISPOSITIVOS MÉDICOS, SETS PARABOMBA DE INFUSIÓN COMPATIBLES CON BOMBAS VOLUMAT AGUILA PARA USO EN PACIENTES DELHOSPITAL DE ATENCIÓN INTEGRAL DEL ADULTO MAYOR 2025","2025.320.1429.0000.90.00.000.005.000.1701.530826.000000.001.0000.0000-","","18154.82","USD"
"ocds-5wno2w-RE-PU-CMFIEDM-2025-002-748941","RE-PU-CMFIEDM-2025-002-748941-2025-04-12T13:20:21.205Z-compiled","TOCILIZUMAB LIQUIDO PARENTERAL 162 MG 0 9 ML CAJA X JERINGAS PRELLENADAS","530809","","8436.00","USD"
"ocds-5wno2w-RE-PU-ESPE-2025-001-30573","RE-PU-ESPE-2025-001-30573-2025-05-20T15:12:40.312Z-compiled","ARRENDAMIENTO PARA EL USO DE LICENCIAS DE HERRAMIENTAS DE CONTROL DE HONESTIDAD ACADÉMICA","2025.189.9999.0000.82.00.000.014.000.1705.530702.000000.001.0000.0000-","","55000.00","USD"
"ocds-5wno2w-RE-PU-GADMATACAMES-2025-0001-20080","RE-PU-GADMATACAMES-2025-0001-20080-2025-06-06T15:46:17.037Z-compiled","SERVICIO DE MANTENIMIENTO PREVENTIVO Y CORRECTIVO DE 4 VOLQUETAS T7H / VOLQUETA / MC11.43 / NUEVO MODELO / 14M3 DESDE LOS 10.000 HASTA LOS 100.000 KILÓMETROS","7.3.04.04","","86147.82","USD"
"ocds-5wno2w-RE-PU-DD10D02AAOS-2025-02-574800","RE-PU-DD10D02AAOS-2025-02-574800-2025-06-24T17:04:35.516Z-compiled","MANTENIMIENTO PREVENTIVO DE EQUIPO BIOMÉDICO TIPO AUTOCLAVE DELHOSPITAL BÁSICO DE ATUNTAQUI PERTENECIENTE LA DIRECCIÓN DISTRITAL10D02-SALUD","2025.320.1257.0000.24.00.052.001.000.1004.730604.000000.202.8888.8888-123200000.0000.386804","","4510.00","USD"
"ocds-5wno2w-RE-PU-GADPP-2025-3-2426","RE-PU-GADPP-2025-3-2426-2025-09-09T20:05:52.109Z-compiled","?SERVICIO DE PARTICIPACIÓN DEL GAD DE LA PROVINCIA DE PICHINCHAEN LAS SEMANAS PRODUCTIVAS Y CULTURALES EN LA PARROQUIA DECALDERÓN","06.36.42.734.001.2025.730205","","103000.00","USD"
"ocds-5wno2w-RE-PU-14D04SALUD-2025-002-13011","RE-PU-14D04SALUD-2025-002-13011-2025-05-08T12:36:22.829Z-compiled","ADQUISICIÓN DE REPUESTOS Y ACCESORIOS QUE INCLUYEN MANTENIMIENTO PREVENTIVO DE TRES VENTILADORES MECÁNICOS Y DOS MONITORES MULTIPARÁMETROS, MARCA: DRAGER UBICADOS EN EL HOSPITAL BÁSICO DE GUALAQUIZA- MISEREOR","2025.320.1361.0000.55.00.000.004.000.1402.530813.000000.001.0000.0000-","","8071.66","USD"
